Symbol,CoinbasePro Pairs,Binance Pairs,Bitfinex Pairs
BTC,"1INCH/BTC, AAVE/BTC, ADA/BTC, ALGO/BTC, ANKR/BTC, ATOM/BTC, AVAX/BTC, AXS/BTC, BAL/BTC, BAND/BTC, BAT/BTC, BCH/BTC, BNT/BTC, BTC/EUR, BTC/GBP, BTC/USD, BTC/USDC, BTC/USDT, BTRST/BTC, CELO/BTC, COMP/BTC, CRV/BTC, CTSI/BTC, DASH/BTC, DOGE/BTC, DOT/BTC, ENJ/BTC, EOS/BTC, ETC/BTC, ETH/BTC, FIL/BTC, FORTH/BTC, GRT/BTC, ICP/BTC, KNC/BTC, LINK/BTC, LRC/BTC, LTC/BTC, MANA/BTC, MATIC/BTC, MIR/BTC, MKR/BTC, NKN/BTC, NMR/BTC, NU/BTC, OGN/BTC, OMG/BTC, ORN/BTC, RAD/BTC, REN/BTC, REP/BTC, REQ/BTC, RLC/BTC, SKL/BTC, SNX/BTC, SOL/BTC, STORJ/BTC, SUSHI/BTC, TRB/BTC, TRU/BTC, UMA/BTC, UNI/BTC, WBTC/BTC, WBTC/USD, WCFG/BTC, XLM/BTC, XRP/BTC, XTZ/BTC, XYO/BTC, YFI/BTC, ZEC/BTC, ZEN/BTC, ZRX/BTC","1INCH/BTC, AAVE/BTC, ACA/BTC, ACE/BTC, ACH/BTC, ACM/BTC, ADA/BTC, ADX/BTC, AE/BTC, AERGO/BTC, AEVO/BTC, AGI/BTC, AGIX/BTC, AGLD/BTC, AI/BTC, AION/BTC, AKRO/BTC, ALCX/BTC, ALGO/BTC, ALICE/BTC, ALPACA/BTC, ALPHA/BTC, ALPINE/BTC, ALT/BTC, AMB/BTC, AMP/BTC, ANC/BTC, ANKR/BTC, ANT/BTC, ANY/BTC, APE/BTC, API3/BTC, APPC/BTC, APT/BTC, AR/BTC, ARB/BTC, ARDR/BTC, ARK/BTC, ARKM/BTC, ARN/BTC, ARPA/BTC, ASR/BTC, AST/BTC, ASTR/BTC, ATA/BTC, ATM/BTC, ATOM/BTC, AUCTION/BTC, AUDIO/BTC, AUTO/BTC, AVA/BTC, AVAX/BTC, AXL/BTC, AXS/BTC, BADGER/BTC, BAKE/BTC, BAL/BTC, BAND/BTC, BAR/BTC, BAT/BTC, BCC/BTC, BCD/BTC, BCH/BTC, BCHABC/BTC, BCN/BTC, BCPT/BTC, BEAM/BTC, BEL/BTC, BETA/BTC, BICO/BTC, BLUR/BTC, BLZ/BTC, BNB/BTC, BNT/BTC, BNX/BTC, BOND/BTC, BOT/BTC, BQX/BTC, BRD/BTC, BSV/BTC, BTC/AEUR, BTC/ARS, BTC/AUD, BTC/BIDR, BTC/BKRW, BTC/BRL, BTC/BUSD, BTC/DAI, BTC/EUR, BTC/FDUSD, BTC/GBP, BTC/IDRT, BTC/JPY, BTC/NGN, BTC/PAX, BTC/PLN, BTC/RON, BTC/RUB, BTC/TRY, BTC/TUSD, BTC/UAH, BTC/USD:BTC, BTC/USD:BTC-240329, BTC/USD:BTC-240628, BTC/USDC, BTC/USDC:USDC, BTC/USDP, BTC/USDS, BTC/USDT, BTC/USDT:USDT, BTC/USDT:USDT-240329, BTC/USDT:USDT-240628, BTC/UST, BTC/VAI, BTC/ZAR, BTCB/BTC, BTCDOM/USDT:USDT, BTCDOWN/USDT, BTCST/BTC, BTCST/BUSD, BTCST/USDT, BTCST/USDT:USDT, BTCUP/USDT, BTG/BTC, BTS/BTC, BTT/BTC, BZRX/BTC, C98/BTC, CAKE/BTC, CDT/BTC, CELO/BTC, CELR/BTC, CFX/BTC, CHAT/BTC, CHESS/BTC, CHR/BTC, CHZ/BTC, CITY/BTC, CKB/BTC, CLOAK/BTC, CLV/BTC, CMT/BTC, CND/BTC, COCOS/BTC, COMP/BTC, COS/BTC, COTI/BTC, CRV/BTC, CTK/BTC, CTSI/BTC, CTXC/BTC, CVC/BTC, CVX/BTC, CYBER/BTC, DAI/BTC, DAR/BTC, DASH/BTC, DATA/BTC, DCR/BTC, DEGO/BTC, DENT/BTC, DGB/BTC, DGD/BTC, DIA/BTC, DLT/BTC, DNT/BTC, DOCK/BTC, DODO/BTC, DOGE/BTC, DOT/BTC, DREP/BTC, DUSK/BTC, DYDX/BTC, DYM/BTC, EASY/BTC, EDO/BTC, EDU/BTC, EGLD/BTC, ELF/BTC, ENG/BTC, ENJ/BTC, ENS/BTC, EOS/BTC, EPS/BTC, ERD/BTC, ETC/BTC, ETH/BTC, ETH/BTC:BTC, EVX/BTC, EZ/BTC, FARM/BTC, FET/BTC, FIDA/BTC, FIL/BTC, FIO/BTC, FIRO/BTC, FIS/BTC, FLM/BTC, FLOW/BTC, FLUX/BTC, FOR/BTC, FORTH/BTC, FRONT/BTC, FTM/BTC, FTT/BTC, FUEL/BTC, FUN/BTC, FXS/BTC, GAL/BTC, GALA/BTC, GAS/BTC, GLM/BTC, GLMR/BTC, GMT/BTC, GMX/BTC, GNO/BTC, GNS/BTC, GNT/BTC, GO/BTC, GRS/BTC, GRT/BTC, GTC/BTC, GTO/BTC, GVT/BTC, GXS/BTC, HARD/BTC, HBAR/BTC, HC/BTC, HFT/BTC, HIGH/BTC, HIVE/BTC, HNT/BTC, HOOK/BTC, HOT/BTC, HSR/BTC, ICN/BTC, ICP/BTC, ICX/BTC, ID/BTC, IDEX/BTC, ILV/BTC, IMX/BTC, INJ/BTC, INS/BTC, IOST/BTC, IOTA/BTC, IOTX/BTC, IRIS/BTC, JASMY/BTC, JOE/BTC, JST/BTC, JUV/BTC, KAVA/BTC, KDA/BTC, KEEP/BTC, KEY/BTC, KLAY/BTC, KMD/BTC, KNC/BTC, KSM/BTC, LAZIO/BTC, LDO/BTC, LEND/BTC, LINA/BTC, LINK/BTC, LIT/BTC, LOKA/BTC, LOOM/BTC, LPT/BTC, LQTY/BTC, LRC/BTC, LSK/BTC, LTC/BTC, LTO/BTC, LUN/BTC, LUNA/BTC, MAGIC/BTC, MANA/BTC, MANTA/BTC, MATIC/BTC, MAV/BTC, MBL/BTC, MBOX/BTC, MC/BTC, MCO/BTC, MDA/BTC, MDT/BTC, MDX/BTC, METIS/BTC, MFT/BTC, MINA/BTC, MIR/BTC, MITH/BTC, MKR/BTC, MLN/BTC, MOB/BTC, MOD/BTC, MOVR/BTC, MTH/BTC, MTL/BTC, MULTI/BTC, NANO/BTC, NAS/BTC, NAV/BTC, NBS/BTC, NCASH/BTC, NEAR/BTC, NEBL/BTC, NEO/BTC, NEXO/BTC, NFP/BTC, NKN/BTC, NMR/BTC, NPXS/BTC, NTRN/BTC, NU/BTC, NULS/BTC, NXS/BTC, OAX/BTC, OCEAN/BTC, OG/BTC, OGN/BTC, OM/BTC, OMG/BTC, ONE/BTC, ONG/BTC, ONT/BTC, OP/BTC, ORDI/BTC, ORN/BTC, OSMO/BTC, OST/BTC, OXT/BTC, PAX/BTC, PAXG/BTC, PDA/BTC, PENDLE/BTC, PEOPLE/BTC, PERL/BTC, PERP/BTC, PHA/BTC, PHB/BTC, PHX/BTC, PIVX/BTC, PIXEL/BTC, PLA/BTC, PNT/BTC, POA/BTC, POE/BTC, POLS/BTC, POLY/BTC, POLYX/BTC, POND/BTC, PORTAL/BTC, PORTO/BTC, POWR/BTC, PPT/BTC, PROM/BTC, PSG/BTC, PYR/BTC, PYTH/BTC, QI/BTC, QKC/BTC, QLC/BTC, QNT/BTC, QSP/BTC, QTUM/BTC, QUICK/BTC, RAD/BTC, RAMP/BTC, RARE/BTC, RCN/BTC, RDN/BTC, RDNT/BTC, REEF/BTC, REN/BTC, RENBTC/BTC, RENBTC/ETH, REP/BTC, REQ/BTC, RGT/BTC, RIF/BTC, RLC/BTC, RNDR/BTC, RONIN/BTC, ROSE/BTC, RPL/BTC, RPX/BTC, RSR/BTC, RUNE/BTC, RVN/BTC, SALT/BTC, SAND/BTC, SANTOS/BTC, SC/BTC, SCRT/BTC, SEI/BTC, SFP/BTC, SKL/BTC, SKY/BTC, SNGLS/BTC, SNM/BTC, SNT/BTC, SNX/BTC, SOL/BTC, SPELL/BTC, SRM/BTC, SSV/BTC, STEEM/BTC, STG/BTC, STMX/BTC, STORJ/BTC, STORM/BTC, STPT/BTC, STRAT/BTC, STRAX/BTC, STRK/BTC, STX/BTC, SUB/BTC, SUI/BTC, SUN/BTC, SUPER/BTC, SUSD/BTC, SUSHI/BTC, SXP/BTC, SYN/BTC, SYS/BTC, TCT/BTC, TFUEL/BTC, THETA/BTC, TIA/BTC, TKO/BTC, TLM/BTC, TNB/BTC, TNT/BTC, TOMO/BTC, TORN/BTC, TRB/BTC, TRIBE/BTC, TRIG/BTC, TROY/BTC, TRU/BTC, TRX/BTC, TUSD/BTC, TVK/BTC, TWT/BTC, UMA/BTC, UNFI/BTC, UNI/BTC, UST/BTC, UTK/BTC, VANRY/BTC, VEN/BTC, VET/BTC, VGX/BTC, VIA/BTC, VIB/BTC, VIBE/BTC, VIC/BTC, VIDT/BTC, VITE/BTC, VOXEL/BTC, WABI/BTC, WAN/BTC, WAVES/BTC, WAXP/BTC, WBTC/BTC, WBTC/BUSD, WBTC/ETH, WBTC/USDT, WIF/BTC, WIN/BTC, WING/BTC, WINGS/BTC, WLD/BTC, WNXM/BTC, WOO/BTC, WPR/BTC, WRX/BTC, WTC/BTC, XAI/BTC, XEM/BTC, XLM/BTC, XMR/BTC, XNO/BTC, XRP/BTC, XTZ/BTC, XVG/BTC, XVS/BTC, XZC/BTC, YFI/BTC, YFII/BTC, YGG/BTC, YOYOW/BTC, ZEC/BTC, ZEN/BTC, ZIL/BTC, ZRX/BTC","ADA/BTC, ALGO/BTC, AMPL/BTC, ATOM/BTC, AVAX/BTC, BMN/BTC, BORG/BTC, BTC/CNHT, BTC/EUR, BTC/EURT, BTC/GBP, BTC/JPY, BTC/MIM, BTC/MXNT, BTC/TRY, BTC/USD, BTC/USDT, BTC/XAUT, BTCDOMF0/USTF0, BTCF0/EUTF0, BTCF0/USTF0, DASH/BTC, DOGE/BTC, DOT/BTC, EOS/BTC, ETC/BTC, ETH/BTC, ETHF0/BTCF0, IOTA/BTC, JST/BTC, LEO/BTC, LTC/BTC, LTCF0/BTCF0, MANA/BTC, MATIC/BTC, NEO/BTC, NEXO/BTC, OMG/BTC, QTF/BTC, SOL/BTC, SOLF0/BTCF0, TESTBTC/TESTUSD, TESTBTC/TESTUSDT, TESTBTCF0/TESTUSDTF0, TRX/BTC, UOS/BTC, VET/BTC, WBT/BTC, XAUT/BTC, XAUTF0/BTCF0, XLM/BTC, XMR/BTC, XRD/BTC, XRP/BTC, XRPF0/BTCF0, XTZ/BTC, ZEC/BTC"
ETH,"ADA/ETH, BAT/ETH, CBETH/ETH, CBETH/USD, ETH/BTC, ETH/DAI, ETH/EUR, ETH/GBP, ETH/USD, ETH/USDC, ETH/USDT, LINK/ETH, LSETH/ETH, LSETH/USD, MANA/ETH, SOL/ETH, SUSHI/ETH","AAVE/ETH, ADA/ETH, ADX/ETH, AE/ETH, AGI/ETH, AION/ETH, ALGO/ETH, AMB/ETH, APE/ETH, APPC/ETH, APT/ETH, ARB/ETH, ARDR/ETH, ARK/ETH, ARN/ETH, ARPA/ETH, AST/ETH, ASTR/ETH, ATOM/ETH, AVAX/ETH, AXS/ETH, BAT/ETH, BCC/ETH, BCD/ETH, BCN/ETH, BCPT/ETH, BEL/ETH, BETA/ETH, BETH/BUSD, BETH/ETH, BETH/USDT, BLZ/ETH, BNB/ETH, BNT/ETH, BOND/ETH, BQX/ETH, BRD/ETH, BSW/ETH, BTG/ETH, BTS/ETH, BURGER/ETH, CDT/ETH, CELR/ETH, CHAT/ETH, CHR/ETH, CLOAK/ETH, CMT/ETH, CND/ETH, COVER/ETH, CRV/ETH, CVC/ETH, CVP/ETH, CYBER/ETH, DAR/ETH, DASH/ETH, DATA/ETH, DENT/ETH, DEXE/ETH, DF/ETH, DGD/ETH, DLT/ETH, DNT/ETH, DOCK/ETH, DOT/ETH, DYDX/ETH, EASY/ETH, EDO/ETH, EGLD/ETH, ELF/ETH, ENG/ETH, ENJ/ETH, EOS/ETH, ETC/ETH, ETH/AEUR, ETH/AUD, ETH/BIDR, ETH/BKRW, ETH/BRL, ETH/BTC, ETH/BTC:BTC, ETH/BUSD, ETH/DAI, ETH/EUR, ETH/FDUSD, ETH/GBP, ETH/JPY, ETH/NGN, ETH/PAX, ETH/PLN, ETH/RUB, ETH/TRY, ETH/TUSD, ETH/UAH, ETH/USD:ETH, ETH/USD:ETH-240329, ETH/USD:ETH-240628, ETH/USDC, ETH/USDC:USDC, ETH/USDP, ETH/USDT, ETH/USDT:USDT, ETH/USDT:USDT-240329, ETH/USDT:USDT-240628, ETH/UST, ETH/ZAR, ETHBEAR/BUSD, ETHBEAR/USDT, ETHBULL/BUSD, ETHBULL/USDT, ETHDOWN/USDT, ETHUP/USDT, ETHW/USDT:USDT, EVX/ETH, EZ/ETH, FARM/ETH, FIL/ETH, FIRO/ETH, FRONT/ETH, FTM/ETH, FTT/ETH, FUEL/ETH, FUN/ETH, GAL/ETH, GALA/ETH, GHST/ETH, GLM/ETH, GMT/ETH, GNT/ETH, GRS/ETH, GRT/ETH, GTO/ETH, GVT/ETH, GXS/ETH, HC/ETH, HEGIC/ETH, HIFI/ETH, HOT/ETH, HSR/ETH, ICN/ETH, ICP/ETH, ICX/ETH, INJ/ETH, INS/ETH, IOST/ETH, IOTA/ETH, IOTX/ETH, JASMY/ETH, KAVA/ETH, KEY/ETH, KMD/ETH, KNC/ETH, KSM/ETH, LEND/ETH, LINK/ETH, LIT/ETH, LOOM/ETH, LRC/ETH, LSK/ETH, LTC/ETH, LUN/ETH, LUNA/ETH, MANA/ETH, MATIC/ETH, MCO/ETH, MDA/ETH, MEME/ETH, MFT/ETH, MOD/ETH, MTH/ETH, MTL/ETH, NANO/ETH, NAS/ETH, NAV/ETH, NCASH/ETH, NEAR/ETH, NEO/ETH, NPXS/ETH, NULS/ETH, NXS/ETH, OAX/ETH, OMG/ETH, ONE/ETH, ONT/ETH, OOKI/ETH, OP/ETH, OST/ETH, PAX/ETH, PEOPLE/ETH, PHX/ETH, POA/ETH, POE/ETH, POWR/ETH, PPT/ETH, PROS/ETH, PUNDIX/ETH, QKC/ETH, QLC/ETH, QSP/ETH, QTUM/ETH, RCN/ETH, RDN/ETH, REI/ETH, RENBTC/ETH, REQ/ETH, RLC/ETH, ROSE/ETH, RPX/ETH, RUNE/ETH, SALT/ETH, SAND/ETH, SC/ETH, SCRT/ETH, SKY/ETH, SLP/ETH, SNGLS/ETH, SNM/ETH, SNT/ETH, SNX/ETH, SOL/ETH, SSV/ETH, STEEM/ETH, STMX/ETH, STORJ/ETH, STORM/ETH, STRAT/ETH, STRAX/ETH, SUB/ETH, SUSD/ETH, SYS/ETH, THETA/ETH, TNB/ETH, TNT/ETH, TRIG/ETH, TRX/ETH, TUSD/ETH, UFT/ETH, UNFI/ETH, UNI/ETH, VEN/ETH, VET/ETH, VGX/ETH, VIA/ETH, VIB/ETH, VIBE/ETH, VOXEL/ETH, WABI/ETH, WAN/ETH, WAVES/ETH, WBETH/ETH, WBETH/USDT, WBTC/ETH, WING/ETH, WINGS/ETH, WPR/ETH, WTC/ETH, XEM/ETH, XLM/ETH, XMR/ETH, XNO/ETH, XRP/ETH, XTZ/ETH, XVG/ETH, XZC/ETH, YOYOW/ETH, ZEC/ETH, ZEN/ETH, ZIL/ETH, ZRX/ETH","EOS/ETH, ETH/BTC, ETH/EUR, ETH/EURT, ETH/GBP, ETH/JPY, ETH/MXNT, ETH/USD, ETH/USDT, ETH/XAUT, ETH2X/ETH, ETH2X/USD, ETH2X/USDT, ETHF0/BTCF0, ETHF0/EUTF0, ETHF0/USTF0, ETHW/USD, ETHW/USDT, LEO/ETH, OMG/ETH, TESTETH/TESTUSD, TESTETHF0/TESTUSDTF0, TRX/ETH"
USDT,"ACH/USDT, ADA/USDT, AGLD/USDT, AIOZ/USDT, ALCX/USDT, APE/USDT, API3/USDT, APT/USDT, ARPA/USDT, ASM/USDT, ATA/USDT, ATOM/USDT, AUCTION/USDT, AVAX/USDT, AXS/USDT, BADGER/USDT, BICO/USDT, BIT/USDT, BOBA/USDT, BOND/USDT, BTC/USDT, BTRST/USDT, C98/USDT, CHZ/USDT, CLV/USDT, COVAL/USDT, CRO/USDT, CTX/USDT, DDX/USDT, DESO/USDT, DIA/USDT, DOGE/USDT, DOT/USDT, DREP/USDT, DYP/USDT, ELA/USDT, ENJ/USDT, ENS/USDT, ERN/USDT, ETH/USDT, FARM/USDT, FET/USDT, FIDA/USDT, FIS/USDT, FLOW/USDT, FORT/USDT, FOX/USDT, GAL/USDT, GALA/USDT, GMT/USDT, GNO/USDT, HBAR/USDT, HFT/USDT, HOPR/USDT, ICP/USDT, IDEX/USDT, IMX/USDT, INDEX/USDT, JASMY/USDT, KRL/USDT, KSM/USDT, LCX/USDT, LINK/USDT, LQTY/USDT, LRC/USDT, MASK/USDT, MATH/USDT, MATIC/USDT, MCO2/USDT, MDT/USDT, MEDIA/USDT, METIS/USDT, MINA/USDT, NCT/USDT, NEAR/USDT, NEST/USDT, OP/USDT, ORN/USDT, PAX/USDT, PERP/USDT, POLS/USDT, POLY/USDT, POND/USDT, POWR/USDT, PRQ/USDT, QNT/USDT, QSP/USDT, RAD/USDT, REQ/USDT, RLY/USDT, RNDR/USDT, ROSE/USDT, SAND/USDT, SHIB/USDT, SHPING/USDT, SOL/USDT, SPELL/USDT, STG/USDT, STX/USDT, SUKU/USDT, SUPER/USDT, SYLO/USDT, TIME/USDT, TRAC/USDT, TRU/USDT, UPI/USDT, USDT/EUR, USDT/GBP, USDT/USD, USDT/USDC, UST/USDT, VGX/USDT, WAMPL/USDT, WCFG/USDT, WLUNA/USDT, XCN/USDT, XLM/USDT, XRP/USDT, XYO/USDT, ZEN/USDT","1000BONK/USDT:USDT, 1000FLOKI/USDT:USDT, 1000LUNC/USDT:USDT, 1000PEPE/USDT:USDT, 1000RATS/USDT:USDT, 1000SATS/USDT, 1000SATS/USDT:USDT, 1000SHIB/USDT:USDT, 1000XEC/USDT:USDT, 1INCH/USDT, 1INCH/USDT:USDT, 1INCHDOWN/USDT, 1INCHUP/USDT, AAVE/USDT, AAVE/USDT:USDT, AAVEDOWN/USDT, AAVEUP/USDT, ACA/USDT, ACE/USDT, ACE/USDT:USDT, ACH/USDT, ACH/USDT:USDT, ACM/USDT, ADA/USDT, ADA/USDT:USDT, ADADOWN/USDT, ADAUP/USDT, ADX/USDT, AERGO/USDT, AEUR/USDT, AEVO/USDT, AEVO/USDT:USDT, AGIX/USDT, AGIX/USDT:USDT, AGLD/USDT, AGLD/USDT:USDT, AI/USDT, AI/USDT:USDT, AION/USDT, AKRO/USDT, ALCX/USDT, ALGO/USDT, ALGO/USDT:USDT, ALICE/USDT, ALICE/USDT:USDT, ALPACA/USDT, ALPHA/USDT, ALPHA/USDT:USDT, ALPINE/USDT, ALT/USDT, ALT/USDT:USDT, AMB/USDT, AMB/USDT:USDT, AMP/USDT, ANC/USDT, ANKR/USDT, ANKR/USDT:USDT, ANT/USDT, ANT/USDT:USDT, ANY/USDT, APE/USDT, APE/USDT:USDT, API3/USDT, API3/USDT:USDT, APT/USDT, APT/USDT:USDT, AR/USDT, AR/USDT:USDT, ARB/USDT, ARB/USDT:USDT, ARDR/USDT, ARK/USDT, ARK/USDT:USDT, ARKM/USDT, ARKM/USDT:USDT, ARPA/USDT, ARPA/USDT:USDT, ASR/USDT, AST/USDT, ASTR/USDT, ASTR/USDT:USDT, ATA/USDT, ATA/USDT:USDT, ATM/USDT, ATOM/USDT, ATOM/USDT:USDT, AUCTION/USDT, AUCTION/USDT:USDT, AUD/USDT, AUDIO/USDT, AUDIO/USDT:USDT, AUTO/USDT, AVA/USDT, AVAX/USDT, AVAX/USDT:USDT, AXL/USDT, AXL/USDT:USDT, AXS/USDT, AXS/USDT:USDT, BADGER/USDT, BADGER/USDT:USDT, BAKE/USDT, BAKE/USDT:USDT, BAL/USDT, BAL/USDT:USDT, BAND/USDT, BAND/USDT:USDT, BAR/USDT, BAT/USDT, BAT/USDT:USDT, BCC/USDT, BCH/USDT, BCH/USDT:USDT, BCHABC/USDT, BCHDOWN/USDT, BCHUP/USDT, BEAM/USDT, BEAMX/USDT, BEAMX/USDT:USDT, BEAR/USDT, BEL/USDT, BEL/USDT:USDT, BETA/USDT, BETH/USDT, BICO/USDT, BICO/USDT:USDT, BIFI/USDT, BIGTIME/USDT:USDT, BKRW/USDT, BLUEBIRD/USDT:USDT, BLUR/USDT, BLUR/USDT:USDT, BLZ/USDT, BLZ/USDT:USDT, BNB/USDT, BNB/USDT:USDT, BNBBEAR/USDT, BNBBULL/USDT, BNBDOWN/USDT, BNBUP/USDT, BNT/USDT, BNT/USDT:USDT, BNX/USDT, BNX/USDT:USDT, BOND/USDT, BOND/USDT:USDT, BONK/USDT, BSV/USDT, BSV/USDT:USDT, BSW/USDT, BTC/USDT, BTC/USDT:USDT, BTC/USDT:USDT-240329, BTC/USDT:USDT-240628, BTCDOM/USDT:USDT, BTCDOWN/USDT, BTCST/USDT, BTCST/USDT:USDT, BTCUP/USDT, BTG/USDT, BTS/USDT, BTS/USDT:USDT, BTT/USDT, BTTC/USDT, BULL/USDT, BURGER/USDT, BUSD/USDT, BZRX/USDT, C98/USDT, C98/USDT:USDT, CAKE/USDT, CAKE/USDT:USDT, CELO/USDT, CELO/USDT:USDT, CELR/USDT, CELR/USDT:USDT, CFX/USDT, CFX/USDT:USDT, CHESS/USDT, CHR/USDT, CHR/USDT:USDT, CHZ/USDT, CHZ/USDT:USDT, CITY/USDT, CKB/USDT, CKB/USDT:USDT, CLV/USDT, COCOS/USDT, COCOS/USDT:USDT, COMBO/USDT, COMBO/USDT:USDT, COMP/USDT, COMP/USDT:USDT, COS/USDT, COTI/USDT, COTI/USDT:USDT, CREAM/USDT, CRV/USDT, CRV/USDT:USDT, CTK/USDT, CTK/USDT:USDT, CTSI/USDT, CTSI/USDT:USDT, CTXC/USDT, CVC/USDT, CVC/USDT:USDT, CVP/USDT, CVX/USDT, CVX/USDT:USDT, CYBER/USDT, CYBER/USDT:USDT, DAI/USDT, DAR/USDT, DAR/USDT:USDT, DASH/USDT, DASH/USDT:USDT, DATA/USDT, DCR/USDT, DEFI/USDT:USDT, DEGO/USDT, DENT/USDT, DENT/USDT:USDT, DEXE/USDT, DF/USDT, DGB/USDT, DGB/USDT:USDT, DIA/USDT, DNT/USDT, DOCK/USDT, DODO/USDT, DODOX/USDT:USDT, DOGE/USDT, DOGE/USDT:USDT, DOT/USDT, DOT/USDT:USDT, DOTDOWN/USDT, DOTUP/USDT, DREP/USDT, DUSK/USDT, DUSK/USDT:USDT, DYDX/USDT, DYDX/USDT:USDT, DYM/USDT, DYM/USDT:USDT, EDU/USDT, EDU/USDT:USDT, EGLD/USDT, EGLD/USDT:USDT, ELF/USDT, ENJ/USDT, ENJ/USDT:USDT, ENS/USDT, ENS/USDT:USDT, EOS/USDT, EOS/USDT:USDT, EOSBEAR/USDT, EOSBULL/USDT, EOSDOWN/USDT, EOSUP/USDT, EPS/USDT, EPX/USDT, ERD/USDT, ERN/USDT, ETC/USDT, ETC/USDT:USDT, ETH/USDT, ETH/USDT:USDT, ETH/USDT:USDT-240329, ETH/USDT:USDT-240628, ETHBEAR/USDT, ETHBULL/USDT, ETHDOWN/USDT, ETHUP/USDT, ETHW/USDT:USDT, EUR/USDT, FARM/USDT, FDUSD/USDT, FET/USDT, FET/USDT:USDT, FIDA/USDT, FIL/USDT, FIL/USDT:USDT, FILDOWN/USDT, FILUP/USDT, FIO/USDT, FIRO/USDT, FIS/USDT, FLM/USDT, FLM/USDT:USDT, FLOKI/USDT, FLOW/USDT, FLOW/USDT:USDT, FLUX/USDT, FOOTBALL/USDT:USDT, FOR/USDT, FORTH/USDT, FRONT/USDT, FRONT/USDT:USDT, FTM/USDT, FTM/USDT:USDT, FTT/USDT, FTT/USDT:USDT, FUN/USDT, FXS/USDT, FXS/USDT:USDT, GAL/USDT, GAL/USDT:USDT, GALA/USDT, GALA/USDT:USDT, GAS/USDT, GAS/USDT:USDT, GBP/USDT, GFT/USDT, GHST/USDT, GLM/USDT, GLM/USDT:USDT, GLMR/USDT, GLMR/USDT:USDT, GMT/USDT, GMT/USDT:USDT, GMX/USDT, GMX/USDT:USDT, GNO/USDT, GNS/USDT, GRT/USDT, GRT/USDT:USDT, GTC/USDT, GTC/USDT:USDT, GTO/USDT, GXS/USDT, HARD/USDT, HBAR/USDT, HBAR/USDT:USDT, HC/USDT, HFT/USDT, HFT/USDT:USDT, HIFI/USDT, HIFI/USDT:USDT, HIGH/USDT, HIGH/USDT:USDT, HIVE/USDT, HNT/USDT, HNT/USDT:USDT, HOOK/USDT, HOOK/USDT:USDT, HOT/USDT, HOT/USDT:USDT, ICP/USDT, ICP/USDT:USDT, ICX/USDT, ICX/USDT:USDT, ID/USDT, ID/USDT:USDT, IDEX/USDT, IDEX/USDT:USDT, ILV/USDT, ILV/USDT:USDT, IMX/USDT, IMX/USDT:USDT, INJ/USDT, INJ/USDT:USDT, IOST/USDT, IOST/USDT:USDT, IOTA/USDT, IOTA/USDT:USDT, IOTX/USDT, IOTX/USDT:USDT, IQ/USDT, IRIS/USDT, JASMY/USDT, JASMY/USDT:USDT, JOE/USDT, JOE/USDT:USDT, JST/USDT, JTO/USDT, JTO/USDT:USDT, JUP/USDT, JUP/USDT:USDT, JUV/USDT, KAS/USDT:USDT, KAVA/USDT, KAVA/USDT:USDT, KDA/USDT, KEEP/USDT, KEY/USDT, KEY/USDT:USDT, KLAY/USDT, KLAY/USDT:USDT, KMD/USDT, KNC/USDT, KNC/USDT:USDT, KP3R/USDT, KSM/USDT, KSM/USDT:USDT, LAZIO/USDT, LDO/USDT, LDO/USDT:USDT, LEND/USDT, LEVER/USDT, LEVER/USDT:USDT, LINA/USDT, LINA/USDT:USDT, LINK/USDT, LINK/USDT:USDT, LINKDOWN/USDT, LINKUP/USDT, LIT/USDT, LIT/USDT:USDT, LOKA/USDT, LOOM/USDT, LOOM/USDT:USDT, LPT/USDT, LPT/USDT:USDT, LQTY/USDT, LQTY/USDT:USDT, LRC/USDT, LRC/USDT:USDT, LSK/USDT, LSK/USDT:USDT, LTC/USDT, LTC/USDT:USDT, LTCDOWN/USDT, LTCUP/USDT, LTO/USDT, LUNA/USDT, LUNA2/USDT:USDT, LUNC/USDT, MAGIC/USDT, MAGIC/USDT:USDT, MANA/USDT, MANA/USDT:USDT, MANTA/USDT, MANTA/USDT:USDT, MASK/USDT, MASK/USDT:USDT, MATIC/USDT, MATIC/USDT:USDT, MAV/USDT, MAV/USDT:USDT, MAVIA/USDT:USDT, MBL/USDT, MBL/USDT:USDT, MBOX/USDT, MC/USDT, MCO/USDT, MDT/USDT, MDT/USDT:USDT, MDX/USDT, MEME/USDT, MEME/USDT:USDT, METIS/USDT, METIS/USDT:USDT, MFT/USDT, MINA/USDT, MINA/USDT:USDT, MIR/USDT, MITH/USDT, MKR/USDT, MKR/USDT:USDT, MLN/USDT, MOB/USDT, MOVR/USDT, MOVR/USDT:USDT, MTL/USDT, MTL/USDT:USDT, MULTI/USDT, MYRO/USDT:USDT, NANO/USDT, NBS/USDT, NEAR/USDT, NEAR/USDT:USDT, NEBL/USDT, NEO/USDT, NEO/USDT:USDT, NEXO/USDT, NFP/USDT, NFP/USDT:USDT, NKN/USDT, NKN/USDT:USDT, NMR/USDT, NMR/USDT:USDT, NPXS/USDT, NTRN/USDT, NTRN/USDT:USDT, NU/USDT, NULS/USDT, OAX/USDT, OCEAN/USDT, OCEAN/USDT:USDT, OG/USDT, OGN/USDT, OGN/USDT:USDT, OM/USDT, OM/USDT:USDT, OMG/USDT, OMG/USDT:USDT, ONDO/USDT:USDT, ONE/USDT, ONE/USDT:USDT, ONG/USDT, ONG/USDT:USDT, ONT/USDT, ONT/USDT:USDT, OOKI/USDT, OP/USDT, OP/USDT:USDT, ORBS/USDT:USDT, ORDI/USDT, ORDI/USDT:USDT, ORN/USDT, OSMO/USDT, OXT/USDT, OXT/USDT:USDT, PAX/USDT, PAXG/USDT, PDA/USDT, PENDLE/USDT, PENDLE/USDT:USDT, PEOPLE/USDT, PEOPLE/USDT:USDT, PEPE/USDT, PERL/USDT, PERP/USDT, PERP/USDT:USDT, PHA/USDT, PHB/USDT, PHB/USDT:USDT, PIVX/USDT, PIXEL/USDT, PIXEL/USDT:USDT, PLA/USDT, PNT/USDT, POLS/USDT, POLY/USDT, POLYX/USDT, POLYX/USDT:USDT, POND/USDT, PORTAL/USDT, PORTAL/USDT:USDT, PORTO/USDT, POWR/USDT, POWR/USDT:USDT, PROM/USDT, PROS/USDT, PSG/USDT, PUNDIX/USDT, PYR/USDT, PYTH/USDT, PYTH/USDT:USDT, QI/USDT, QKC/USDT, QNT/USDT, QNT/USDT:USDT, QTUM/USDT, QTUM/USDT:USDT, QUICK/USDT, RAD/USDT, RAD/USDT:USDT, RAMP/USDT, RARE/USDT, RAY/USDT, RAY/USDT:USDT, RDNT/USDT, RDNT/USDT:USDT, REEF/USDT, REEF/USDT:USDT, REI/USDT, REN/USDT, REN/USDT:USDT, REP/USDT, REQ/USDT, RGT/USDT, RIF/USDT, RIF/USDT:USDT, RLC/USDT, RLC/USDT:USDT, RNDR/USDT, RNDR/USDT:USDT, RONIN/USDT, RONIN/USDT:USDT, ROSE/USDT, ROSE/USDT:USDT, RPL/USDT, RSR/USDT, RSR/USDT:USDT, RUNE/USDT, RUNE/USDT:USDT, RVN/USDT, RVN/USDT:USDT, SAND/USDT, SAND/USDT:USDT, SANTOS/USDT, SC/USDT, SC/USDT:USDT, SCRT/USDT, SEI/USDT, SEI/USDT:USDT, SFP/USDT, SFP/USDT:USDT, SHIB/USDT, SKL/USDT, SKL/USDT:USDT, SLP/USDT, SLP/USDT:USDT, SNT/USDT, SNT/USDT:USDT, SNX/USDT, SNX/USDT:USDT, SOL/USDT, SOL/USDT:USDT, SPELL/USDT, SPELL/USDT:USDT, SRM/USDT, SRM/USDT:USDT, SSV/USDT, SSV/USDT:USDT, STEEM/USDT, STEEM/USDT:USDT, STG/USDT, STG/USDT:USDT, STMX/USDT, STMX/USDT:USDT, STORJ/USDT, STORJ/USDT:USDT, STORM/USDT, STPT/USDT, STPT/USDT:USDT, STRAT/USDT, STRAX/USDT, STRAX/USDT:USDT, STRK/USDT, STRK/USDT:USDT, STX/USDT, STX/USDT:USDT, SUI/USDT, SUI/USDT:USDT, SUN/USDT, SUPER/USDT, SUPER/USDT:USDT, SUSD/USDT, SUSHI/USDT, SUSHI/USDT:USDT, SUSHIDOWN/USDT, SUSHIUP/USDT, SXP/USDT, SXP/USDT:USDT, SXPDOWN/USDT, SXPUP/USDT, SYN/USDT, SYS/USDT, T/USDT, T/USDT:USDT, TCT/USDT, TFUEL/USDT, THETA/USDT, THETA/USDT:USDT, TIA/USDT, TIA/USDT:USDT, TKO/USDT, TLM/USDT, TLM/USDT:USDT, TOKEN/USDT:USDT, TOMO/USDT, TOMO/USDT:USDT, TON/USDT:USDT, TORN/USDT, TRB/USDT, TRB/USDT:USDT, TRIBE/USDT, TROY/USDT, TRU/USDT, TRU/USDT:USDT, TRX/USDT, TRX/USDT:USDT, TRXDOWN/USDT, TRXUP/USDT, TUSD/USDT, TVK/USDT, TWT/USDT, TWT/USDT:USDT, UFT/USDT, UMA/USDT, UMA/USDT:USDT, UNFI/USDT, UNFI/USDT:USDT, UNI/USDT, UNI/USDT:USDT, UNIDOWN/USDT, UNIUP/USDT, USDC/USDT, USDC/USDT:USDT, USDP/USDT, USDS/USDT, USDSB/USDT, USDT/ARS, USDT/BIDR, USDT/BKRW, USDT/BRL, USDT/BVND, USDT/DAI, USDT/IDRT, USDT/NGN, USDT/PLN, USDT/RON, USDT/RUB, USDT/TRY, USDT/UAH, USDT/VAI, USDT/ZAR, UST/USDT, USTC/USDT, USTC/USDT:USDT, UTK/USDT, VANRY/USDT, VANRY/USDT:USDT, VEN/USDT, VET/USDT, VET/USDT:USDT, VGX/USDT, VIB/USDT, VIC/USDT, VIDT/USDT, VITE/USDT, VOXEL/USDT, VTHO/USDT, WAN/USDT, WAVES/USDT, WAVES/USDT:USDT, WAXP/USDT, WAXP/USDT:USDT, WBETH/USDT, WBTC/USDT, WIF/USDT, WIF/USDT:USDT, WIN/USDT, WING/USDT, WLD/USDT, WLD/USDT:USDT, WNXM/USDT, WOO/USDT, WOO/USDT:USDT, WRX/USDT, WTC/USDT, XAI/USDT, XAI/USDT:USDT, XEC/USDT, XEM/USDT, XEM/USDT:USDT, XLM/USDT, XLM/USDT:USDT, XLMDOWN/USDT, XLMUP/USDT, XMR/USDT, XMR/USDT:USDT, XNO/USDT, XRP/USDT, XRP/USDT:USDT, XRPBEAR/USDT, XRPBULL/USDT, XRPDOWN/USDT, XRPUP/USDT, XTZ/USDT, XTZ/USDT:USDT, XTZDOWN/USDT, XTZUP/USDT, XVG/USDT, XVG/USDT:USDT, XVS/USDT, XVS/USDT:USDT, XZC/USDT, YFI/USDT, YFI/USDT:USDT, YFIDOWN/USDT, YFII/USDT, YFIUP/USDT, YGG/USDT, YGG/USDT:USDT, ZEC/USDT, ZEC/USDT:USDT, ZEN/USDT, ZEN/USDT:USDT, ZETA/USDT:USDT, ZIL/USDT, ZIL/USDT:USDT, ZRX/USDT, ZRX/USDT:USDT","1INCH/USDT, AAVE/USDT, ADA/USDT, ALGO/USDT, ALT2612/USDT, AMPL/USDT, APE/USDT, APENFT/USDT, APP/USDT, APT/USDT, ARB/USDT, ATOM/USDT, AVAX/USDT, AXS/USDT, AZERO/USDT, B2M/USDT, BAL/USDT, BAND/USDT, BGB/USDT, BLUR/USDT, BONK/USDT, BORG/USDT, BOSON/USDT, BTC/USDT, CCD/USDT, CELO/USDT, CHZ/USDT, COMP/USDT, CRV/USDT, DOGE/USDT, DOT/USDT, DYM/USDT, EGLD/USDT, EOS/USDT, ETC/USDT, ETH/USDT, ETH2X/USDT, ETHW/USDT, EUR/USDT, EURT/USDT, FCL/USDT, FET/USDT, FIL/USDT, FLOKI/USDT, FLR/USDT, FORTH/USDT, FTM/USDT, GALA/USDT, GBP/USDT, GMMT/USDT, GOC/USDT, GOMINING/USDT, GRT/USDT, GTX/USDT, HIX/USDT, HMT/USDT, HTX/USDT, ICP/USDT, INJ/USDT, JASMY/USDT, JPY/USDT, JST/USDT, JUP/USDT, KAN/USDT, KARATE/USDT, KAVA/USDT, KSM/USDT, LDO/USDT, LEO/USDT, LIFIII/USDT, LINK/USDT, LTC/USDT, LUNA/USDT, MATIC/USDT, MEME/USDT, MIM/USDT, MKR/USDT, NEAR/USDT, NEO/USDT, NEXO/USDT, NOM/USDT, OCEAN/USDT, OGN/USDT, OPX/USDT, PAX/USDT, PEPE/USDT, QRDO/USDT, RLY/USDT, SAND/USDT, SEI/USDT, SGB/USDT, SHIB/USDT, SMR/USDT, SNX/USDT, SOL/USDT, SPELL/USDT, STG/USDT, STRK/USDT, SUI/USDT, SUKU/USDT, SUN/USDT, SUSHI/USDT, SWEAT/USDT, TESTADAF0/TESTUSDTF0, TESTALGOF0/TESTUSDTF0, TESTAPTF0/TESTUSDTF0, TESTAVAXF0/TESTUSDTF0, TESTBTC/TESTUSDT, TESTBTCF0/TESTUSDTF0, TESTDOGEF0/TESTUSDTF0, TESTDOTF0/TESTUSDTF0, TESTEOSF0/TESTUSDTF0, TESTETHF0/TESTUSDTF0, TESTFILF0/TESTUSDTF0, TESTLTCF0/TESTUSDTF0, TESTMATIC/TESTUSDT, TESTMATICF0/TESTUSDTF0, TESTNEARF0/TESTUSDTF0, TESTSOLF0/TESTUSDTF0, TESTXAUTF0/TESTUSDTF0, TESTXTZF0/TESTUSDTF0, THETA/USDT, TIA/USDT, TOMI/USDT, TON/USDT, TRADE/USDT, TRX/USDT, TRY/USDT, TUSD/USDT, UNI/USDT, USDC/USDT, USDT/CNHT, USDT/MXNT, USDT/USD, VET/USDT, VRA/USDT, WAVES/USDT, WHBT/USDT, WIF/USDT, WILD/USDT, WMINIMA/USDT, WOO/USDT, XAUT/USDT, XDC/USDT, XLM/USDT, XMR/USDT, XRP/USDT, XTP/USDT, XTZ/USDT, YFI/USDT, ZETA/USDT"
BNB,,"AAVE/BNB, ACE/BNB, ADA/BNB, ADX/BNB, AE/BNB, AEVO/BNB, AGI/BNB, AGLD/BNB, AI/BNB, AION/BNB, ALGO/BNB, ALICE/BNB, ALPACA/BNB, ALPHA/BNB, ALT/BNB, AMB/BNB, AMP/BNB, ANC/BNB, ANKR/BNB, ANT/BNB, APE/BNB, API3/BNB, APPC/BNB, AR/BNB, ARDR/BNB, ARKM/BNB, ARPA/BNB, ATA/BNB, ATOM/BNB, AVA/BNB, AVAX/BNB, AXS/BNB, BAKE/BNB, BAL/BNB, BAND/BNB, BAT/BNB, BCC/BNB, BCH/BNB, BCN/BNB, BCPT/BNB, BEAM/BNB, BEL/BNB, BETA/BNB, BIFI/BNB, BLZ/BNB, BNB/AUD, BNB/BIDR, BNB/BKRW, BNB/BRL, BNB/BTC, BNB/BUSD, BNB/DAI, BNB/ETH, BNB/EUR, BNB/FDUSD, BNB/GBP, BNB/IDRT, BNB/JPY, BNB/NGN, BNB/PAX, BNB/RUB, BNB/TRY, BNB/TUSD, BNB/UAH, BNB/USD:BNB, BNB/USD:BNB-240329, BNB/USD:BNB-240628, BNB/USDC, BNB/USDC:USDC, BNB/USDP, BNB/USDS, BNB/USDT, BNB/USDT:USDT, BNB/UST, BNB/ZAR, BNBBEAR/BUSD, BNBBEAR/USDT, BNBBULL/BUSD, BNBBULL/USDT, BNBDOWN/USDT, BNBUP/USDT, BNX/BNB, BOND/BNB, BRD/BNB, BSW/BNB, BTS/BNB, BTT/BNB, BURGER/BNB, BZRX/BNB, C98/BNB, CAKE/BNB, CELR/BNB, CHESS/BNB, CHR/BNB, CHZ/BNB, CITY/BNB, CLV/BNB, CMT/BNB, CND/BNB, COCOS/BNB, COMBO/BNB, COMP/BNB, COS/BNB, COTI/BNB, CREAM/BNB, CRV/BNB, CTK/BNB, CTSI/BNB, CTXC/BNB, CVC/BNB, CYBER/BNB, DAI/BNB, DAR/BNB, DASH/BNB, DCR/BNB, DIA/BNB, DLT/BNB, DOGE/BNB, DOT/BNB, DREP/BNB, DUSK/BNB, DYDX/BNB, EDU/BNB, EGLD/BNB, ENJ/BNB, ENS/BNB, EOS/BNB, ERD/BNB, ERN/BNB, ETC/BNB, FARM/BNB, FET/BNB, FIDA/BNB, FIL/BNB, FIO/BNB, FLM/BNB, FLOW/BNB, FOR/BNB, FTM/BNB, FTT/BNB, FUN/BNB, GAL/BNB, GALA/BNB, GLMR/BNB, GMT/BNB, GNO/BNB, GNT/BNB, GO/BNB, GTC/BNB, GTO/BNB, GXS/BNB, HARD/BNB, HBAR/BNB, HIGH/BNB, HIVE/BNB, HOOK/BNB, HOT/BNB, ICP/BNB, ICX/BNB, ID/BNB, IDEX/BNB, ILV/BNB, IMX/BNB, INJ/BNB, IOTA/BNB, IQ/BNB, IRIS/BNB, JASMY/BNB, JST/BNB, KAVA/BNB, KEEP/BNB, KLAY/BNB, KNC/BNB, KP3R/BNB, KSM/BNB, LINA/BNB, LINK/BNB, LOKA/BNB, LOOM/BNB, LPT/BNB, LRC/BNB, LSK/BNB, LTC/BNB, LTO/BNB, LUNA/BNB, MANA/BNB, MANTA/BNB, MASK/BNB, MATIC/BNB, MBL/BNB, MBOX/BNB, MC/BNB, MCO/BNB, MDT/BNB, MDX/BNB, MEME/BNB, MFT/BNB, MINA/BNB, MITH/BNB, MKR/BNB, MLN/BNB, MOVR/BNB, NANO/BNB, NAS/BNB, NAV/BNB, NCASH/BNB, NEAR/BNB, NEBL/BNB, NEO/BNB, NFP/BNB, NKN/BNB, NTRN/BNB, NU/BNB, NULS/BNB, NXS/BNB, OCEAN/BNB, OGN/BNB, OMG/BNB, ONE/BNB, ONG/BNB, ONT/BNB, OOKI/BNB, OP/BNB, OST/BNB, PAX/BNB, PAXG/BNB, PEOPLE/BNB, PERL/BNB, PHB/BNB, PHX/BNB, PIVX/BNB, PIXEL/BNB, PLA/BNB, POA/BNB, POLS/BNB, POLY/BNB, PORTAL/BNB, POWR/BNB, PROM/BNB, QI/BNB, QLC/BNB, QNT/BNB, QSP/BNB, QTUM/BNB, QUICK/BNB, RAD/BNB, RARE/BNB, RAY/BNB, RCN/BNB, RDN/BNB, REI/BNB, REN/BNB, REP/BNB, RGT/BNB, RLC/BNB, ROSE/BNB, RPX/BNB, RSR/BNB, RUNE/BNB, SAND/BNB, SEI/BNB, SKY/BNB, SLP/BNB, SNX/BNB, SOL/BNB, SPARTA/BNB, SPELL/BNB, SRM/BNB, STEEM/BNB, STORM/BNB, STPT/BNB, STRAT/BNB, STX/BNB, SUI/BNB, SUSHI/BNB, SWRV/BNB, SXP/BNB, SYS/BNB, TCT/BNB, TFUEL/BNB, THETA/BNB, TLM/BNB, TOMO/BNB, TORN/BNB, TRB/BNB, TRIBE/BNB, TRIG/BNB, TROY/BNB, TRX/BNB, TUSD/BNB, UNFI/BNB, UNI/BNB, USDC/BNB, VEN/BNB, VET/BNB, VIA/BNB, VITE/BNB, VOXEL/BNB, VTHO/BNB, WABI/BNB, WAN/BNB, WAVES/BNB, WAXP/BNB, WIN/BNB, WING/BNB, WNXM/BNB, WOO/BNB, WRX/BNB, WTC/BNB, XAI/BNB, XEM/BNB, XLM/BNB, XMR/BNB, XRP/BNB, XTZ/BNB, XVS/BNB, XZC/BNB, YFI/BNB, YFII/BNB, YGG/BNB, YOYOW/BNB, ZEC/BNB, ZEN/BNB, ZIL/BNB, ZRX/BNB",BNBF0/USTF0
SOL,"MSOL/USD, SOL/BTC, SOL/ETH, SOL/EUR, SOL/GBP, SOL/USD, SOL/USDT","SOL/AUD, SOL/BIDR, SOL/BNB, SOL/BRL, SOL/BTC, SOL/BUSD, SOL/ETH, SOL/EUR, SOL/FDUSD, SOL/GBP, SOL/RUB, SOL/TRY, SOL/TUSD, SOL/USD:SOL, SOL/USDC, SOL/USDC:USDC, SOL/USDT, SOL/USDT:USDT","SOL/BTC, SOL/USD, SOL/USDT, SOLF0/BTCF0, SOLF0/USTF0, TESTSOL/TESTUSD, TESTSOLF0/TESTUSDTF0"
STETH,,,"TESTETH/TESTUSD, TESTETHF0/TESTUSDTF0"
