Symbol,CoinbasePro Pairs,Binance Pairs,Bitfinex Pairs
XRP,"XRP/BTC, XRP/EUR, XRP/GBP, XRP/USD, XRP/USDT","TRX/XRP, XRP/AUD, XRP/BIDR, XRP/BKRW, XRP/BNB, XRP/BRL, XRP/BTC, XRP/BUSD, XRP/ETH, XRP/EUR, XRP/FDUSD, XRP/GBP, XRP/NGN, XRP/PAX, XRP/RUB, XRP/TRY, XRP/TUSD, XRP/USD:XRP, XRP/USD:XRP-240329, XRP/USD:XRP-240628, XRP/USDC, XRP/USDC:USDC, XRP/USDT, XRP/USDT:USDT, XRPBEAR/BUSD, XRPBEAR/USDT, XRPBULL/BUSD, XRPBULL/USDT, XRPDOWN/USDT, XRPUP/USDT, XZC/XRP","XRP/BTC, XRP/USD, XRP/USDT, XRPF0/BTCF0, XRPF0/USTF0"
USDC,"ADA/USDC, BAT/USDC, BTC/USDC, CVC/USDC, DAI/USDC, DNT/USDC, ETH/USDC, GNT/USDC, LOOM/USDC, MANA/USDC, USDC/EUR, USDC/GBP, USDT/USDC, ZEC/USDC","1000PEPE/USDC:USDC, ADA/USDC, ALGO/USDC, ALT/USDC, ANKR/USDC, ARB/USDC, ATOM/USDC, AUD/USDC, AVAX/USDC, BAT/USDC, BCH/USDC, BCHABC/USDC, BCPT/USDC, BGBP/USDC, BLUR/USDC, BNB/USDC, BNB/USDC:USDC, BSV/USDC, BTC/USDC, BTC/USDC:USDC, BTT/USDC, BTTC/USDC, DOGE/USDC, DOGE/USDC:USDC, DOT/USDC, DUSK/USDC, EOS/USDC, ERD/USDC, ETC/USDC, ETH/USDC, ETH/USDC:USDC, EUR/USDC, FET/USDC, FIL/USDC, FTM/USDC, GTO/USDC, INJ/USDC, JUP/USDC, LINK/USDC, LINK/USDC:USDC, LTC/USDC, MANTA/USDC, MATIC/USDC, NEAR/USDC, NEO/USDC, NPXS/USDC, ONE/USDC, ONT/USDC, OP/USDC, ORDI/USDC, ORDI/USDC:USDC, PEPE/USDC, PERL/USDC, PHB/USDC, PIXEL/USDC, SEI/USDC, SHIB/USDC, SOL/USDC, SOL/USDC:USDC, STRK/USDC, SUI/USDC, SUI/USDC:USDC, TFUEL/USDC, TIA/USDC, TOMO/USDC, TRX/USDC, UNI/USDC, USDC/BNB, USDC/BUSD, USDC/PAX, USDC/TUSD, USDC/USDT, USDC/USDT:USDT, USDS/USDC, WAVES/USDC, WIN/USDC, WLD/USDC, WLD/USDC:USDC, XLM/USDC, XRP/USDC, XRP/USDC:USDC, ZEC/USDC","USDC/USD, USDC/USDT"
ADA,"ADA/BTC, ADA/ETH, ADA/EUR, ADA/GBP, ADA/USD, ADA/USDC, ADA/USDT","ADA/AUD, ADA/BIDR, ADA/BKRW, ADA/BNB, ADA/BRL, ADA/BTC, ADA/BUSD, ADA/ETH, ADA/EUR, ADA/FDUSD, ADA/GBP, ADA/PAX, ADA/RUB, ADA/TRY, ADA/TUSD, ADA/USD:ADA, ADA/USD:ADA-240329, ADA/USD:ADA-240628, ADA/USDC, ADA/USDT, ADA/USDT:USDT, ADADOWN/USDT, ADAUP/USDT","ADA/BTC, ADA/USD, ADA/USDT, ADAF0/USTF0, TESTADA/TESTUSD, TESTADAF0/TESTUSDTF0"
DOGE,"DOGE/BTC, DOGE/EUR, DOGE/GBP, DOGE/USD, DOGE/USDT","DOGE/AUD, DOGE/BIDR, DOGE/BNB, DOGE/BRL, DOGE/BTC, DOGE/BUSD, DOGE/EUR, DOGE/FDUSD, DOGE/GBP, DOGE/PAX, DOGE/RUB, DOGE/TRY, DOGE/TUSD, DOGE/USD:DOGE, DOGE/USDC, DOGE/USDC:USDC, DOGE/USDT, DOGE/USDT:USDT, SHIB/DOGE","DOGE/BTC, DOGE/USD, DOGE/USDT, DOGEF0/USTF0, TESTDOGE/TESTUSD, TESTDOGEF0/TESTUSDTF0"
AVAX,"AVAX/BTC, AVAX/EUR, AVAX/USD, AVAX/USDT","AVAX/AUD, AVAX/BIDR, AVAX/BNB, AVAX/BRL, AVAX/BTC, AVAX/BUSD, AVAX/ETH, AVAX/EUR, AVAX/FDUSD, AVAX/GBP, AVAX/TRY, AVAX/TUSD, AVAX/USD:AVAX, AVAX/USDC, AVAX/USDT, AVAX/USDT:USDT","AVAX/BTC, AVAX/USD, AVAX/USDT, AVAXF0/USTF0, TESTAVAX/TESTUSD, TESTAVAXF0/TESTUSDTF0"
SHIB,"SHIB/EUR, SHIB/GBP, SHIB/USD, SHIB/USDT","1000SHIB/USDT:USDT, SHIB/AUD, SHIB/BRL, SHIB/BUSD, SHIB/DOGE, SHIB/EUR, SHIB/FDUSD, SHIB/GBP, SHIB/RUB, SHIB/TRY, SHIB/TUSD, SHIB/UAH, SHIB/USDC, SHIB/USDT","SHIB/USD, SHIB/USDT, SHIBF0/USTF0"
DOT,"DOT/BTC, DOT/EUR, DOT/GBP, DOT/USD, DOT/USDT","BDOT/DOT, DOT/AUD, DOT/BIDR, DOT/BKRW, DOT/BNB, DOT/BRL, DOT/BTC, DOT/BUSD, DOT/ETH, DOT/EUR, DOT/FDUSD, DOT/GBP, DOT/NGN, DOT/RUB, DOT/TRY, DOT/TUSD, DOT/USD:DOT, DOT/USD:DOT-240329, DOT/USD:DOT-240628, DOT/USDC, DOT/USDT, DOT/USDT:USDT, DOTDOWN/USDT, DOTUP/USDT","DOT/BTC, DOT/USD, DOT/USDT, DOTF0/USTF0, TESTDOT/TESTUSD, TESTDOTF0/TESTUSDTF0"
TON,TONE/USD,TON/USDT:USDT,"TON/USD, TON/USDT"
LINK,"LINK/BTC, LINK/ETH, LINK/EUR, LINK/GBP, LINK/USD, LINK/USDT","LINK/AUD, LINK/BKRW, LINK/BNB, LINK/BRL, LINK/BTC, LINK/BUSD, LINK/ETH, LINK/EUR, LINK/FDUSD, LINK/GBP, LINK/NGN, LINK/PAX, LINK/TRY, LINK/TUSD, LINK/USD:LINK, LINK/USD:LINK-240329, LINK/USD:LINK-240628, LINK/USDC, LINK/USDC:USDC, LINK/USDT, LINK/USDT:USDT, LINKDOWN/USDT, LINKUP/USDT","LINK/USD, LINK/USDT, LINKF0/USTF0"
TRX,,"BTT/TRX, TRX/AUD, TRX/BNB, TRX/BTC, TRX/BUSD, TRX/ETH, TRX/EUR, TRX/NGN, TRX/PAX, TRX/TRY, TRX/TUSD, TRX/USD:TRX, TRX/USDC, TRX/USDT, TRX/USDT:USDT, TRX/XRP, TRXDOWN/USDT, TRXUP/USDT, WIN/TRX","TRX/BTC, TRX/ETH, TRX/EUR, TRX/USD, TRX/USDT, TRXF0/USTF0"
MATIC,"MATIC/BTC, MATIC/EUR, MATIC/GBP, MATIC/USD, MATIC/USDT","MATIC/AUD, MATIC/BIDR, MATIC/BNB, MATIC/BRL, MATIC/BTC, MATIC/BUSD, MATIC/ETH, MATIC/EUR, MATIC/FDUSD, MATIC/GBP, MATIC/RUB, MATIC/TRY, MATIC/TUSD, MATIC/USD:MATIC, MATIC/USDC, MATIC/USDT, MATIC/USDT:USDT","MATIC/BTC, MATIC/USD, MATIC/USDT, MATICF0/USTF0, TESTMATIC/TESTUSD, TESTMATIC/TESTUSDT, TESTMATICF0/TESTUSDTF0"
WBTC,"WBTC/BTC, WBTC/USD","WBTC/BTC, WBTC/BUSD, WBTC/ETH, WBTC/USDT",
UNI,"UNI/BTC, UNI/EUR, UNI/GBP, UNI/USD","UNI/AUD, UNI/BNB, UNI/BTC, UNI/BUSD, UNI/ETH, UNI/EUR, UNI/FDUSD, UNI/TRY, UNI/USD:UNI, UNI/USDC, UNI/USDT, UNI/USDT:USDT, UNIDOWN/USDT, UNIUP/USDT","UNI/USD, UNI/USDT, UNIF0/USTF0"
BCH,"BCH/BTC, BCH/EUR, BCH/GBP, BCH/USD","BCH/BNB, BCH/BTC, BCH/BUSD, BCH/EUR, BCH/FDUSD, BCH/PAX, BCH/TRY, BCH/TUSD, BCH/USD:BCH, BCH/USD:BCH-240329, BCH/USD:BCH-240628, BCH/USDC, BCH/USDT, BCH/USDT:USDT, BCHA/BUSD, BCHABC/BTC, BCHABC/BUSD, BCHABC/PAX, BCHABC/TUSD, BCHABC/USDC, BCHABC/USDT, BCHDOWN/USDT, BCHUP/USDT",BCH/USD
NEAR,"NEAR/USD, NEAR/USDT","NEAR/BNB, NEAR/BTC, NEAR/BUSD, NEAR/ETH, NEAR/EUR, NEAR/FDUSD, NEAR/RUB, NEAR/TRY, NEAR/USD:NEAR, NEAR/USDC, NEAR/USDT, NEAR/USDT:USDT","NEAR/USD, NEAR/USDT, NEARF0/USTF0, TESTNEAR/TESTUSD, TESTNEARF0/TESTUSDTF0"
LTC,"LTC/BTC, LTC/EUR, LTC/GBP, LTC/USD","LTC/BNB, LTC/BRL, LTC/BTC, LTC/BUSD, LTC/ETH, LTC/EUR, LTC/FDUSD, LTC/GBP, LTC/NGN, LTC/PAX, LTC/RUB, LTC/TRY, LTC/TUSD, LTC/UAH, LTC/USD:LTC, LTC/USD:LTC-240329, LTC/USD:LTC-240628, LTC/USDC, LTC/USDT, LTC/USDT:USDT, LTCDOWN/USDT, LTCUP/USDT","LTC/BTC, LTC/USD, LTC/USDT, LTCF0/BTCF0, LTCF0/USTF0, TESTLTC/TESTUSD, TESTLTCF0/TESTUSDTF0"
ICP,"ICP/BTC, ICP/EUR, ICP/GBP, ICP/USD, ICP/USDT","ICP/BNB, ICP/BTC, ICP/BUSD, ICP/ETH, ICP/EUR, ICP/FDUSD, ICP/RUB, ICP/TRY, ICP/USDT, ICP/USDT:USDT","ICP/USD, ICP/USDT, ICPF0/USTF0"
LEO,,,"LEO/BTC, LEO/ETH, LEO/USD, LEO/USDT"
FIL,"FIL/BTC, FIL/EUR, FIL/GBP, FIL/USD","FIL/BNB, FIL/BTC, FIL/BUSD, FIL/ETH, FIL/FDUSD, FIL/TRY, FIL/USD:FIL, FIL/USDC, FIL/USDT, FIL/USDT:USDT, FILDOWN/USDT, FILUP/USDT","FIL/USD, FIL/USDT, FILF0/USTF0, TESTFIL/TESTUSD, TESTFILF0/TESTUSDTF0"
APT,"APT/USD, APT/USDT","APT/BRL, APT/BTC, APT/BUSD, APT/ETH, APT/EUR, APT/FDUSD, APT/TRY, APT/USD:APT, APT/USDT, APT/USDT:USDT","APT/USD, APT/USDT, APTF0/USTF0, TESTAPT/TESTUSD, TESTAPTF0/TESTUSDTF0"
ATOM,"ATOM/BTC, ATOM/EUR, ATOM/GBP, ATOM/USD, ATOM/USDT","ATOM/BIDR, ATOM/BNB, ATOM/BRL, ATOM/BTC, ATOM/BUSD, ATOM/ETH, ATOM/EUR, ATOM/FDUSD, ATOM/PAX, ATOM/TRY, ATOM/TUSD, ATOM/USD:ATOM, ATOM/USDC, ATOM/USDT, ATOM/USDT:USDT","ATOM/BTC, ATOM/USD, ATOM/USDT"
ETC,"ETC/BTC, ETC/EUR, ETC/GBP, ETC/USD","ETC/BNB, ETC/BRL, ETC/BTC, ETC/BUSD, ETC/ETH, ETC/EUR, ETC/FDUSD, ETC/GBP, ETC/PAX, ETC/TRY, ETC/TUSD, ETC/USD:ETC, ETC/USDC, ETC/USDT, ETC/USDT:USDT","ETC/BTC, ETC/USD, ETC/USDT, ETCF0/USTF0"
DAI,"DAI/USD, DAI/USDC, ETH/DAI","BNB/DAI, BTC/DAI, BUSD/DAI, DAI/BNB, DAI/BTC, DAI/BUSD, DAI/USDT, ETH/DAI, USDT/DAI",DAI/USD
IMX,"IMX/USD, IMX/USDT","IMX/BNB, IMX/BTC, IMX/BUSD, IMX/TRY, IMX/USDT, IMX/USDT:USDT",
INJ,INJ/USD,"INJ/BNB, INJ/BTC, INJ/BUSD, INJ/ETH, INJ/FDUSD, INJ/TRY, INJ/TUSD, INJ/USDC, INJ/USDT, INJ/USDT:USDT","INJ/USD, INJ/USDT"
HBAR,"HBAR/USD, HBAR/USDT","HBAR/BNB, HBAR/BTC, HBAR/BUSD, HBAR/TRY, HBAR/USDT, HBAR/USDT:USDT",
RNDR,"RNDR/EUR, RNDR/USD, RNDR/USDT","RNDR/BTC, RNDR/BUSD, RNDR/FDUSD, RNDR/TRY, RNDR/USDT, RNDR/USDT:USDT",
STX,"STX/USD, STX/USDT","STX/BNB, STX/BTC, STX/BUSD, STX/FDUSD, STX/TRY, STX/USDT, STX/USDT:USDT","TESTXAUT/TESTUSD, TESTXAUTF0/TESTUSDTF0, TESTXTZ/TESTUSD, TESTXTZF0/TESTUSDTF0"
OP,"HOPR/USD, HOPR/USDT, OP/USD, OP/USDT","OP/BNB, OP/BTC, OP/BUSD, OP/ETH, OP/EUR, OP/FDUSD, OP/TRY, OP/TUSD, OP/USD:OP, OP/USDC, OP/USDT, OP/USDT:USDT, PEOPLE/BNB, PEOPLE/BTC, PEOPLE/BUSD, PEOPLE/ETH, PEOPLE/USDT, PEOPLE/USDT:USDT","EUROPE50IXF0/USTF0, OPX/USD, OPX/USDT"
PEPE,,"1000PEPE/USDC:USDC, 1000PEPE/USDT:USDT, PEPE/FDUSD, PEPE/TRY, PEPE/TUSD, PEPE/USDC, PEPE/USDT","PEPE/USD, PEPE/USDT"
XLM,"XLM/BTC, XLM/EUR, XLM/USD, XLM/USDT","XLM/BNB, XLM/BTC, XLM/BUSD, XLM/ETH, XLM/EUR, XLM/PAX, XLM/TRY, XLM/TUSD, XLM/USD:XLM, XLM/USDC, XLM/USDT, XLM/USDT:USDT, XLMDOWN/USDT, XLMUP/USDT","XLM/BTC, XLM/USD, XLM/USDT, XLMF0/USTF0"
OKB,,,
CRO,"CRO/EUR, CRO/USD, CRO/USDT",,
GRT,"GRT/BTC, GRT/EUR, GRT/GBP, GRT/USD","GRT/BTC, GRT/BUSD, GRT/ETH, GRT/EUR, GRT/FDUSD, GRT/TRY, GRT/USDT, GRT/USDT:USDT","GRT/USD, GRT/USDT"
TAO,,,
VET,VET/USD,"VET/BNB, VET/BTC, VET/BUSD, VET/ETH, VET/EUR, VET/GBP, VET/TRY, VET/USD:VET-221226, VET/USDT, VET/USDT:USDT","VET/BTC, VET/USD, VET/USDT"
THETA,,"THETA/BNB, THETA/BTC, THETA/BUSD, THETA/ETH, THETA/EUR, THETA/FDUSD, THETA/TRY, THETA/USD:THETA, THETA/USDT, THETA/USDT:USDT","THETA/USD, THETA/USDT"
KAS,,KAS/USDT:USDT,
MNT,,,
WIF,,"WIF/BTC, WIF/FDUSD, WIF/TRY, WIF/USDT, WIF/USDT:USDT","WIF/USD, WIF/USDT"
RUNE,,"RUNE/AUD, RUNE/BNB, RUNE/BTC, RUNE/BUSD, RUNE/ETH, RUNE/EUR, RUNE/FDUSD, RUNE/GBP, RUNE/TRY, RUNE/TUSD, RUNE/USD:RUNE, RUNE/USDT, RUNE/USDT:USDT",
FDUSD,,"1000SATS/FDUSD, ACE/FDUSD, ADA/FDUSD, AEVO/FDUSD, AGIX/FDUSD, AI/FDUSD, ALGO/FDUSD, ALT/FDUSD, APT/FDUSD, ARB/FDUSD, ATOM/FDUSD, AUCTION/FDUSD, AVAX/FDUSD, AXL/FDUSD, BCH/FDUSD, BLUR/FDUSD, BLZ/FDUSD, BNB/FDUSD, BONK/FDUSD, BTC/FDUSD, CHZ/FDUSD, CYBER/FDUSD, DOGE/FDUSD, DOT/FDUSD, DYDX/FDUSD, DYM/FDUSD, EGLD/FDUSD, ENS/FDUSD, ETC/FDUSD, ETH/FDUSD, FDUSD/BUSD, FDUSD/TRY, FDUSD/USDT, FET/FDUSD, FIL/FDUSD, FLOKI/FDUSD, FTM/FDUSD, GALA/FDUSD, GAS/FDUSD, GRT/FDUSD, ICP/FDUSD, INJ/FDUSD, IOTA/FDUSD, JTO/FDUSD, JUP/FDUSD, LDO/FDUSD, LINK/FDUSD, LTC/FDUSD, MAGIC/FDUSD, MANTA/FDUSD, MATIC/FDUSD, MEME/FDUSD, METIS/FDUSD, NEAR/FDUSD, NFP/FDUSD, OP/FDUSD, ORDI/FDUSD, PENDLE/FDUSD, PEPE/FDUSD, PIXEL/FDUSD, PORTAL/FDUSD, PYTH/FDUSD, RNDR/FDUSD, RONIN/FDUSD, RUNE/FDUSD, SAND/FDUSD, SEI/FDUSD, SHIB/FDUSD, SOL/FDUSD, STRK/FDUSD, STX/FDUSD, SUI/FDUSD, SUPER/FDUSD, THETA/FDUSD, TIA/FDUSD, UNI/FDUSD, USTC/FDUSD, WIF/FDUSD, WLD/FDUSD, XAI/FDUSD, XRP/FDUSD",
ARB,ARB/USD,"ARB/BTC, ARB/ETH, ARB/EUR, ARB/FDUSD, ARB/RUB, ARB/TRY, ARB/TUSD, ARB/USDC, ARB/USDT, ARB/USDT:USDT","ARB/USD, ARB/USDT, ARBF0/USTF0"
LDO,LDO/USD,"FILDOWN/USDT, LDO/BTC, LDO/BUSD, LDO/FDUSD, LDO/TRY, LDO/TUSD, LDO/USDT, LDO/USDT:USDT","LDO/USD, LDO/USDT"
TIA,TIA/USD,"TIA/BTC, TIA/FDUSD, TIA/TRY, TIA/TUSD, TIA/USDC, TIA/USDT, TIA/USDT:USDT","TIA/USD, TIA/USDT"
FET,"FET/USD, FET/USDT","FET/BNB, FET/BTC, FET/BUSD, FET/FDUSD, FET/TRY, FET/USDC, FET/USDT, FET/USDT:USDT","FET/USD, FET/USDT"
FLOKI,,"1000FLOKI/USDT:USDT, FLOKI/FDUSD, FLOKI/TRY, FLOKI/TUSD, FLOKI/USDT","FLOKI/USD, FLOKI/USDT"
MKR,"MKR/BTC, MKR/USD","MKR/BNB, MKR/BTC, MKR/BUSD, MKR/USDT, MKR/USDT:USDT","MKR/USD, MKR/USDT, MKRF0/USTF0"
XMR,,"XMR/BNB, XMR/BTC, XMR/BUSD, XMR/ETH, XMR/USDT, XMR/USDT:USDT","XMR/BTC, XMR/USD, XMR/USDT, XMRF0/USTF0"
ALGO,"ALGO/BTC, ALGO/EUR, ALGO/GBP, ALGO/USD","ALGO/BIDR, ALGO/BNB, ALGO/BTC, ALGO/BUSD, ALGO/ETH, ALGO/FDUSD, ALGO/PAX, ALGO/RUB, ALGO/TRY, ALGO/TUSD, ALGO/USD:ALGO, ALGO/USDC, ALGO/USDT, ALGO/USDT:USDT","ALGO/BTC, ALGO/USD, ALGO/USDT, TESTALGO/TESTUSD, TESTALGOF0/TESTUSDTF0"
FTM,,"FTM/AUD, FTM/BIDR, FTM/BNB, FTM/BRL, FTM/BTC, FTM/BUSD, FTM/ETH, FTM/EUR, FTM/FDUSD, FTM/PAX, FTM/RUB, FTM/TRY, FTM/TUSD, FTM/USD:FTM, FTM/USDC, FTM/USDT, FTM/USDT:USDT","FTM/USD, FTM/USDT, FTMF0/USTF0"
GALA,"GALA/EUR, GALA/USD, GALA/USDT","GALA/AUD, GALA/BNB, GALA/BRL, GALA/BTC, GALA/BUSD, GALA/ETH, GALA/EUR, GALA/FDUSD, GALA/TRY, GALA/USD:GALA-221226, GALA/USDT, GALA/USDT:USDT","GALA/USD, GALA/USDT, GALAF0/USTF0"
AR,"ARB/USD, ARPA/EUR, ARPA/USD, ARPA/USDT, DAR/USD, FARM/USD, FARM/USDT, HBAR/USD, HBAR/USDT, NEAR/USD, NEAR/USDT, RARE/USD, RARI/USD, VARA/USD","AR/BNB, AR/BTC, AR/BUSD, AR/TRY, AR/USDT, AR/USDT:USDT, ARB/BTC, ARB/ETH, ARB/EUR, ARB/FDUSD, ARB/RUB, ARB/TRY, ARB/TUSD, ARB/USDC, ARB/USDT, ARB/USDT:USDT, ARDR/BNB, ARDR/BTC, ARDR/ETH, ARDR/USDT, ARK/BTC, ARK/BUSD, ARK/ETH, ARK/TRY, ARK/USDT, ARK/USDT:USDT, ARKM/BNB, ARKM/BTC, ARKM/RUB, ARKM/TRY, ARKM/TUSD, ARKM/USDT, ARKM/USDT:USDT, ARN/BTC, ARN/ETH, ARPA/BNB, ARPA/BTC, ARPA/BUSD, ARPA/ETH, ARPA/RUB, ARPA/TRY, ARPA/USDT, ARPA/USDT:USDT, BAR/BTC, BAR/BUSD, BAR/TRY, BAR/USDT, BEAR/BUSD, BEAR/USDT, BNB/ZAR, BNBBEAR/BUSD, BNBBEAR/USDT, BTC/ARS, BTC/ZAR, BUSD/ZAR, DAR/BNB, DAR/BTC, DAR/BUSD, DAR/ETH, DAR/EUR, DAR/TRY, DAR/USDT, DAR/USDT:USDT, EOSBEAR/BUSD, EOSBEAR/USDT, ETH/ZAR, ETHBEAR/BUSD, ETHBEAR/USDT, FARM/BNB, FARM/BTC, FARM/BUSD, FARM/ETH, FARM/USDT, HARD/BNB, HARD/BTC, HARD/BUSD, HARD/USDT, HBAR/BNB, HBAR/BTC, HBAR/BUSD, HBAR/TRY, HBAR/USDT, HBAR/USDT:USDT, NEAR/BNB, NEAR/BTC, NEAR/BUSD, NEAR/ETH, NEAR/EUR, NEAR/FDUSD, NEAR/RUB, NEAR/TRY, NEAR/USD:NEAR, NEAR/USDC, NEAR/USDT, NEAR/USDT:USDT, RARE/BNB, RARE/BTC, RARE/BUSD, RARE/TRY, RARE/USDT, SPARTA/BNB, USDT/ARS, USDT/ZAR, XRPBEAR/BUSD, XRPBEAR/USDT","ARB/USD, ARB/USDT, ARBF0/USTF0, KARATE/USD, KARATE/USDT, NEAR/USD, NEAR/USDT, NEARF0/USTF0, TESTNEAR/TESTUSD, TESTNEARF0/TESTUSDTF0"
RETH,,,
BONK,BONK/USD,"1000BONK/USDT:USDT, BONK/FDUSD, BONK/TRY, BONK/USDT","BONK/USD, BONK/USDT"
FLOW,"FLOW/USD, FLOW/USDT","FLOW/BNB, FLOW/BTC, FLOW/BUSD, FLOW/USDT, FLOW/USDT:USDT",
SEI,SEI/USD,"SEI/BNB, SEI/BTC, SEI/FDUSD, SEI/TRY, SEI/TUSD, SEI/USDC, SEI/USDT, SEI/USDT:USDT","SEI/USD, SEI/USDT"
METH,,,
BSV,,"BSV/BTC, BSV/PAX, BSV/TUSD, BSV/USDC, BSV/USDT, BSV/USDT:USDT",
AAVE,"AAVE/BTC, AAVE/EUR, AAVE/GBP, AAVE/USD","AAVE/BKRW, AAVE/BNB, AAVE/BRL, AAVE/BTC, AAVE/BUSD, AAVE/ETH, AAVE/USD:AAVE, AAVE/USDT, AAVE/USDT:USDT, AAVEDOWN/USDT, AAVEUP/USDT","AAVE/USD, AAVE/USDT, AAVEF0/USTF0"
QNT,"QNT/USD, QNT/USDT","QNT/BNB, QNT/BTC, QNT/BUSD, QNT/USDT, QNT/USDT:USDT",
BEAM,,"BEAM/BNB, BEAM/BTC, BEAM/USDT, BEAMX/TRY, BEAMX/USDT, BEAMX/USDT:USDT",
EGLD,EGLD/USD,"EGLD/BNB, EGLD/BTC, EGLD/BUSD, EGLD/ETH, EGLD/EUR, EGLD/FDUSD, EGLD/RON, EGLD/USD:EGLD, EGLD/USDT, EGLD/USDT:USDT","EGLD/USD, EGLD/USDT, EGLDF0/USTF0"
SUI,SUI/USD,"SUI/BNB, SUI/BTC, SUI/EUR, SUI/FDUSD, SUI/TRY, SUI/TUSD, SUI/USDC, SUI/USDC:USDC, SUI/USDT, SUI/USDT:USDT","SUI/USD, SUI/USDT"
STRK,STRK/USD,"STRK/BTC, STRK/FDUSD, STRK/TRY, STRK/USDC, STRK/USDT, STRK/USDT:USDT","STRK/USD, STRK/USDT"
AXS,"AXS/BTC, AXS/EUR, AXS/USD, AXS/USDT","AXS/AUD, AXS/BNB, AXS/BRL, AXS/BTC, AXS/BUSD, AXS/ETH, AXS/TRY, AXS/USD:AXS, AXS/USDT, AXS/USDT:USDT","AXS/USD, AXS/USDT, AXSF0/USTF0"
DYDX,,"DYDX/BNB, DYDX/BTC, DYDX/BUSD, DYDX/ETH, DYDX/FDUSD, DYDX/TRY, DYDX/USDT, DYDX/USDT:USDT",
SAND,"SAND/USD, SAND/USDT","SAND/AUD, SAND/BIDR, SAND/BNB, SAND/BRL, SAND/BTC, SAND/BUSD, SAND/ETH, SAND/FDUSD, SAND/TRY, SAND/USD:SAND, SAND/USDT, SAND/USDT:USDT","SAND/USD, SAND/USDT, SANDF0/USTF0"
ORDI,,"ORDI/BTC, ORDI/FDUSD, ORDI/TRY, ORDI/TUSD, ORDI/USDC, ORDI/USDC:USDC, ORDI/USDT, ORDI/USDT:USDT",
BTT,,"BTT/BNB, BTT/BRL, BTT/BTC, BTT/BUSD, BTT/EUR, BTT/PAX, BTT/TRX, BTT/TRY, BTT/TUSD, BTT/USDC, BTT/USDT, BTTC/BUSD, BTTC/TRY, BTTC/USDC, BTTC/USDT",BTT/USD
SNX,"SNX/BTC, SNX/EUR, SNX/GBP, SNX/USD","SNX/BNB, SNX/BTC, SNX/BUSD, SNX/ETH, SNX/TRY, SNX/USDT, SNX/USDT:USDT","SNX/USD, SNX/USDT"
AGIX,,"AGIX/BTC, AGIX/BUSD, AGIX/FDUSD, AGIX/TRY, AGIX/USDT, AGIX/USDT:USDT",
MINA,"MINA/EUR, MINA/USD, MINA/USDT","MINA/BNB, MINA/BTC, MINA/BUSD, MINA/TRY, MINA/USDT, MINA/USDT:USDT",
WEETH,,,
RBN,RBN/USD,,
KCS,,,
WLD,,"WLD/BTC, WLD/FDUSD, WLD/RUB, WLD/TRY, WLD/USDC, WLD/USDC:USDC, WLD/USDT, WLD/USDT:USDT",
FLR,FLR/USD,,"FLR/USD, FLR/USDT"
APE,"APE/EUR, APE/USD, APE/USDT","APE/AUD, APE/BNB, APE/BRL, APE/BTC, APE/BUSD, APE/ETH, APE/EUR, APE/GBP, APE/TRY, APE/USD:APE, APE/USDT, APE/USDT:USDT","APE/USD, APE/USDT, APEF0/USTF0, APENFT/USD, APENFT/USDT"
CHZ,"CHZ/EUR, CHZ/GBP, CHZ/USD, CHZ/USDT","CHZ/BNB, CHZ/BRL, CHZ/BTC, CHZ/BUSD, CHZ/EUR, CHZ/FDUSD, CHZ/GBP, CHZ/TRY, CHZ/USD:CHZ, CHZ/USDT, CHZ/USDT:USDT","CHZ/USD, CHZ/USDT"
CFX,,"CFX/BTC, CFX/BUSD, CFX/TRY, CFX/TUSD, CFX/USDT, CFX/USDT:USDT",
MANA,"MANA/BTC, MANA/ETH, MANA/EUR, MANA/USD, MANA/USDC","MANA/BIDR, MANA/BNB, MANA/BRL, MANA/BTC, MANA/BUSD, MANA/ETH, MANA/TRY, MANA/USD:MANA, MANA/USDT, MANA/USDT:USDT","MANA/BTC, MANA/USD"
XTZ,"XTZ/BTC, XTZ/EUR, XTZ/GBP, XTZ/USD","XTZ/BNB, XTZ/BTC, XTZ/BUSD, XTZ/ETH, XTZ/TRY, XTZ/USD:XTZ, XTZ/USDT, XTZ/USDT:USDT, XTZDOWN/USDT, XTZUP/USDT","TESTXTZ/TESTUSD, TESTXTZF0/TESTUSDTF0, XTZ/BTC, XTZ/USD, XTZ/USDT, XTZF0/USTF0"
TKX,,,
EETH,,,
HNT,HNT/USD,"HNT/BTC, HNT/BUSD, HNT/USDT, HNT/USDT:USDT",
EOS,"EOS/BTC, EOS/EUR, EOS/USD","EOS/AUD, EOS/BNB, EOS/BTC, EOS/BUSD, EOS/ETH, EOS/EUR, EOS/PAX, EOS/TRY, EOS/TUSD, EOS/USD:EOS, EOS/USDC, EOS/USDT, EOS/USDT:USDT, EOSBEAR/BUSD, EOSBEAR/USDT, EOSBULL/BUSD, EOSBULL/USDT, EOSDOWN/USDT, EOSUP/USDT","EOS/BTC, EOS/ETH, EOS/USD, EOS/USDT, EOSF0/USTF0, TESTEOS/TESTUSD, TESTEOSF0/TESTUSDTF0"
SATS,,"1000SATS/FDUSD, 1000SATS/TRY, 1000SATS/USDT, 1000SATS/USDT:USDT",
TUSD,,"ADA/TUSD, AI/TUSD, ALGO/TUSD, ANKR/TUSD, ARB/TUSD, ARKM/TUSD, ATOM/TUSD, AVAX/TUSD, BAT/TUSD, BCH/TUSD, BCHABC/TUSD, BCPT/TUSD, BNB/TUSD, BSV/TUSD, BTC/TUSD, BTT/TUSD, CAKE/TUSD, CFX/TUSD, COMP/TUSD, CYBER/TUSD, DOGE/TUSD, DOT/TUSD, EDU/TUSD, EOS/TUSD, ETC/TUSD, ETH/TUSD, FLOKI/TUSD, FRONT/TUSD, FTM/TUSD, GTO/TUSD, ID/TUSD, INJ/TUSD, LDO/TUSD, LINK/TUSD, LTC/TUSD, MATIC/TUSD, MAV/TUSD, MEME/TUSD, NEO/TUSD, NFP/TUSD, ONE/TUSD, OP/TUSD, ORDI/TUSD, PAX/TUSD, PENDLE/TUSD, PEPE/TUSD, PHB/TUSD, QUICK/TUSD, RDNT/TUSD, RUNE/TUSD, SEI/TUSD, SHIB/TUSD, SOL/TUSD, SSV/TUSD, SUI/TUSD, TFUEL/TUSD, TIA/TUSD, TRX/TUSD, TUSD/BNB, TUSD/BTC, TUSD/BUSD, TUSD/ETH, TUSD/TRY, TUSD/USDT, TUSDB/TUSD, USDC/TUSD, USDS/TUSD, WAVES/TUSD, XAI/TUSD, XLM/TUSD, XRP/TUSD, XVG/TUSD, ZEC/TUSD","TESTADA/TESTUSD, TESTADAF0/TESTUSDTF0, TESTALGO/TESTUSD, TESTALGOF0/TESTUSDTF0, TESTAPT/TESTUSD, TESTAPTF0/TESTUSDTF0, TESTAVAX/TESTUSD, TESTAVAXF0/TESTUSDTF0, TESTBTC/TESTUSD, TESTBTC/TESTUSDT, TESTBTCF0/TESTUSDTF0, TESTDOGE/TESTUSD, TESTDOGEF0/TESTUSDTF0, TESTDOT/TESTUSD, TESTDOTF0/TESTUSDTF0, TESTEOS/TESTUSD, TESTEOSF0/TESTUSDTF0, TESTETH/TESTUSD, TESTETHF0/TESTUSDTF0, TESTFIL/TESTUSD, TESTFILF0/TESTUSDTF0, TESTLTC/TESTUSD, TESTLTCF0/TESTUSDTF0, TESTMATIC/TESTUSD, TESTMATIC/TESTUSDT, TESTMATICF0/TESTUSDTF0, TESTNEAR/TESTUSD, TESTNEARF0/TESTUSDTF0, TESTSOL/TESTUSD, TESTSOLF0/TESTUSDTF0, TESTXAUT/TESTUSD, TESTXAUTF0/TESTUSDTF0, TESTXTZ/TESTUSD, TESTXTZF0/TESTUSDTF0, TUSD/USD, TUSD/USDT"
PYTH,,"PYTH/BTC, PYTH/FDUSD, PYTH/TRY, PYTH/USDT, PYTH/USDT:USDT",
AKT,,,
RON,,"BTC/RON, BUSD/RON, EGLD/RON, FRONT/BTC, FRONT/BUSD, FRONT/ETH, FRONT/TRY, FRONT/TUSD, FRONT/USDT, FRONT/USDT:USDT, RONIN/BTC, RONIN/FDUSD, RONIN/TRY, RONIN/USDT, RONIN/USDT:USDT, USDT/RON",
XEC,,"1000XEC/USDT:USDT, XEC/BUSD, XEC/TRY, XEC/USDT",
BGB,,BGBP/USDC,"BGB/USD, BGB/USDT"
JUP,JUP/USD,"JUP/FDUSD, JUP/TRY, JUP/USDC, JUP/USDT, JUP/USDT:USDT","JUP/USD, JUP/USDT"
WBT,"WBTC/BTC, WBTC/USD","WBTC/BTC, WBTC/BUSD, WBTC/ETH, WBTC/USDT","WBT/BTC, WBT/USD"
IOTA,,"IOTA/BNB, IOTA/BTC, IOTA/BUSD, IOTA/ETH, IOTA/FDUSD, IOTA/TRY, IOTA/USDT, IOTA/USDT:USDT","IOTA/BTC, IOTA/USD"
AXL,"AXL/USD, WAXL/USD","AXL/BTC, AXL/FDUSD, AXL/TRY, AXL/USDT, AXL/USDT:USDT",
NEO,,"NEO/BNB, NEO/BTC, NEO/BUSD, NEO/ETH, NEO/PAX, NEO/RUB, NEO/TRY, NEO/TUSD, NEO/USDC, NEO/USDT, NEO/USDT:USDT","NEO/BTC, NEO/USD, NEO/USDT, NEOF0/USTF0"
CAKE,,"CAKE/AUD, CAKE/BNB, CAKE/BRL, CAKE/BTC, CAKE/BUSD, CAKE/GBP, CAKE/TRY, CAKE/TUSD, CAKE/USDT, CAKE/USDT:USDT",
ETHDYDX,,,
FRXETH,,,
KAVA,KAVA/USD,"KAVA/BNB, KAVA/BTC, KAVA/BUSD, KAVA/ETH, KAVA/USDT, KAVA/USDT:USDT","KAVA/USD, KAVA/USDT"
MSOL,MSOL/USD,,
ROSE,"ROSE/USD, ROSE/USDT","ROSE/BNB, ROSE/BTC, ROSE/BUSD, ROSE/ETH, ROSE/TRY, ROSE/USD:ROSE, ROSE/USDT, ROSE/USDT:USDT",
CORGIAI,,,
KLAY,,"KLAY/BNB, KLAY/BTC, KLAY/BUSD, KLAY/USDT, KLAY/USDT:USDT",
GNO,"GNO/USD, GNO/USDT","GNO/BNB, GNO/BTC, GNO/BUSD, GNO/USDT",GNO/USD
OSMO,OSMO/USD,"OSMO/BTC, OSMO/BUSD, OSMO/USDT",
WEMIX,,,
ZRX,"ZRX/BTC, ZRX/EUR, ZRX/USD","BZRX/BNB, BZRX/BTC, BZRX/BUSD, BZRX/USDT, ZRX/BNB, ZRX/BTC, ZRX/BUSD, ZRX/ETH, ZRX/USDT, ZRX/USDT:USDT",ZRX/USD
LUNC,,"1000LUNC/USDT:USDT, LUNC/BUSD, LUNC/TRY, LUNC/USDT",
USDE,,,
BLUR,BLUR/USD,"BLUR/BTC, BLUR/FDUSD, BLUR/TRY, BLUR/USDC, BLUR/USDT, BLUR/USDT:USDT","BLUR/USD, BLUR/USDT"
WOO,,"WOO/BNB, WOO/BTC, WOO/BUSD, WOO/USDT, WOO/USDT:USDT","WOO/USD, WOO/USDT"
CHEEL,,,
DYM,,"DYM/BTC, DYM/FDUSD, DYM/TRY, DYM/USDT, DYM/USDT:USDT","DYM/USD, DYM/USDT"
CRV,"CRV/BTC, CRV/EUR, CRV/GBP, CRV/USD","CRV/BNB, CRV/BTC, CRV/BUSD, CRV/ETH, CRV/USDT, CRV/USDT:USDT","CRV/USD, CRV/USDT, CRVF0/USTF0"
JASMY,"JASMY/USD, JASMY/USDT","JASMY/BNB, JASMY/BTC, JASMY/BUSD, JASMY/ETH, JASMY/EUR, JASMY/TRY, JASMY/USDT, JASMY/USDT:USDT","JASMY/USD, JASMY/USDT, JASMYF0/USTF0"
SWETH,,,
GT,"BIGTIME/USD, GTC/USD, RGT/USD","BIGTIME/USDT:USDT, GTC/BNB, GTC/BTC, GTC/BUSD, GTC/USDT, GTC/USDT:USDT, GTO/BNB, GTO/BTC, GTO/BUSD, GTO/ETH, GTO/PAX, GTO/TUSD, GTO/USDC, GTO/USDT, RGT/BNB, RGT/BTC, RGT/BUSD, RGT/USDT","GTX/USD, GTX/USDT"
ASTR,,"ASTR/BTC, ASTR/BUSD, ASTR/ETH, ASTR/USDT, ASTR/USDT:USDT",
BTG,,"BTG/BTC, BTG/BUSD, BTG/ETH, BTG/USDT",
MANTA,,"MANTA/BNB, MANTA/BTC, MANTA/FDUSD, MANTA/TRY, MANTA/USDC, MANTA/USDT, MANTA/USDT:USDT",
CKB,,"CKB/BTC, CKB/BUSD, CKB/TRY, CKB/USDT, CKB/USDT:USDT",
ILV,ILV/USD,"ILV/BNB, ILV/BTC, ILV/BUSD, ILV/USDT, ILV/USDT:USDT",
ENJ,"ENJ/BTC, ENJ/USD, ENJ/USDT","ENJ/BNB, ENJ/BRL, ENJ/BTC, ENJ/BUSD, ENJ/ETH, ENJ/EUR, ENJ/GBP, ENJ/TRY, ENJ/USDT, ENJ/USDT:USDT",
NEXO,,"NEXO/BTC, NEXO/BUSD, NEXO/USDT","NEXO/BTC, NEXO/USD, NEXO/USDT"
SFRXETH,,,
AIOZ,"AIOZ/USD, AIOZ/USDT",,
ONDO,ONDO/USD,ONDO/USDT:USDT,
HOT,,"HOT/BNB, HOT/BRL, HOT/BTC, HOT/BUSD, HOT/ETH, HOT/EUR, HOT/TRY, HOT/USDT, HOT/USDT:USDT",
MEME,,"MEME/BNB, MEME/ETH, MEME/FDUSD, MEME/TRY, MEME/TUSD, MEME/USDT, MEME/USDT:USDT","MEME/USD, MEME/USDT"
IOTX,"IOTX/EUR, IOTX/USD","IOTX/BTC, IOTX/BUSD, IOTX/ETH, IOTX/USDT, IOTX/USDT:USDT",
ENS,"ENS/EUR, ENS/USD, ENS/USDT","ENS/BNB, ENS/BTC, ENS/BUSD, ENS/FDUSD, ENS/TRY, ENS/USD:ENS, ENS/USDT, ENS/USDT:USDT",
CBETH,"CBETH/ETH, CBETH/USD",,
CELO,"CELO/BTC, CELO/EUR, CELO/GBP, CELO/USD","CELO/BTC, CELO/BUSD, CELO/USDT, CELO/USDT:USDT","CELO/USD, CELO/USDT"
1INCH,"1INCH/BTC, 1INCH/EUR, 1INCH/GBP, 1INCH/USD","1INCH/BTC, 1INCH/BUSD, 1INCH/USDT, 1INCH/USDT:USDT, 1INCHDOWN/USDT, 1INCHUP/USDT","1INCH/USD, 1INCH/USDT"
USDD,,,
STSOL,,,"TESTSOL/TESTUSD, TESTSOLF0/TESTUSDTF0"
RPL,RPL/USD,"RPL/BTC, RPL/BUSD, RPL/USDT",
RSETH,,,
FXS,,"FXS/BTC, FXS/BUSD, FXS/USDT, FXS/USDT:USDT",
XDC,,,"XDC/USD, XDC/USDT"
LUNA,"WLUNA/EUR, WLUNA/GBP, WLUNA/USD, WLUNA/USDT","LUNA/AUD, LUNA/BIDR, LUNA/BNB, LUNA/BRL, LUNA/BTC, LUNA/BUSD, LUNA/ETH, LUNA/EUR, LUNA/GBP, LUNA/TRY, LUNA/USDT, LUNA/UST, LUNA2/USDT:USDT","LUNA/USD, LUNA/USDT"
XRD,,,"XRD/BTC, XRD/USD"
ZIL,,"ZIL/BIDR, ZIL/BNB, ZIL/BTC, ZIL/BUSD, ZIL/ETH, ZIL/EUR, ZIL/TRY, ZIL/USD:ZIL-221226, ZIL/USDT, ZIL/USDT:USDT",ZIL/USD
OCEAN,OCEAN/USD,"OCEAN/BNB, OCEAN/BTC, OCEAN/BUSD, OCEAN/TRY, OCEAN/USDT, OCEAN/USDT:USDT","OCEAN/USD, OCEAN/USDT"
ID,"FIDA/EUR, FIDA/USD, FIDA/USDT, IDEX/USD, IDEX/USDT","ADA/BIDR, ALGO/BIDR, ALICE/BIDR, ATOM/BIDR, AVAX/BIDR, BNB/BIDR, BNB/IDRT, BTC/BIDR, BTC/IDRT, BUSD/BIDR, BUSD/IDRT, DOGE/BIDR, DOT/BIDR, ETH/BIDR, FIDA/BNB, FIDA/BTC, FIDA/BUSD, FIDA/TRY, FIDA/USDT, FIS/BIDR, FTM/BIDR, ID/BNB, ID/BTC, ID/EUR, ID/TRY, ID/TUSD, ID/USDT, ID/USDT:USDT, IDEX/BNB, IDEX/BTC, IDEX/BUSD, IDEX/USDT, IDEX/USDT:USDT, LUNA/BIDR, MANA/BIDR, MATIC/BIDR, ONE/BIDR, REEF/BIDR, SAND/BIDR, SLP/BIDR, SOL/BIDR, SRM/BIDR, SUSHIDOWN/USDT, SXP/BIDR, TKO/BIDR, UNIDOWN/USDT, USDT/BIDR, USDT/IDRT, VIDT/BTC, VIDT/BUSD, VIDT/USDT, XRP/BIDR, YFIDOWN/USDT, ZIL/BIDR","ID/USD, SIDUS/USD"
METIS,"METIS/USD, METIS/USDT","METIS/BTC, METIS/FDUSD, METIS/TRY, METIS/USDT, METIS/USDT:USDT",
PRIME,PRIME/USD,,
LPT,LPT/USD,"LPT/BNB, LPT/BTC, LPT/BUSD, LPT/TRY, LPT/USDT, LPT/USDT:USDT",
TWT,,"TWT/BTC, TWT/BUSD, TWT/TRY, TWT/USDT, TWT/USDT:USDT",
GMT,"GMT/USD, GMT/USDT","GMT/AUD, GMT/BNB, GMT/BRL, GMT/BTC, GMT/BUSD, GMT/ETH, GMT/EUR, GMT/GBP, GMT/TRY, GMT/USD:GMT, GMT/USDT, GMT/USDT:USDT",
FRAX,,,
AMP,"AMP/USD, WAMPL/USD, WAMPL/USDT","AMP/BNB, AMP/BTC, AMP/BUSD, AMP/TRY, AMP/USDT, RAMP/BTC, RAMP/BUSD, RAMP/USDT","AMPL/BTC, AMPL/USD, AMPL/USDT"
LRC,"LRC/BTC, LRC/USD, LRC/USDT","LRC/BNB, LRC/BTC, LRC/BUSD, LRC/ETH, LRC/TRY, LRC/USDT, LRC/USDT:USDT",LRC/USD
NFT,,,"APENFT/USD, APENFT/USDT"
ARKM,,"ARKM/BNB, ARKM/BTC, ARKM/RUB, ARKM/TRY, ARKM/TUSD, ARKM/USDT, ARKM/USDT:USDT",
SUPER,"SUPER/USD, SUPER/USDT","SUPER/BTC, SUPER/BUSD, SUPER/FDUSD, SUPER/TRY, SUPER/USDT, SUPER/USDT:USDT",
SC,,"SC/BTC, SC/BUSD, SC/ETH, SC/USDT, SC/USDT:USDT, SCRT/BTC, SCRT/BUSD, SCRT/ETH, SCRT/USDT",
GLM,GLM/USD,"GLM/BTC, GLM/BUSD, GLM/ETH, GLM/USDT, GLM/USDT:USDT, GLMR/BNB, GLMR/BTC, GLMR/BUSD, GLMR/USDT, GLMR/USDT:USDT",
ALT,,"ALT/BNB, ALT/BTC, ALT/FDUSD, ALT/TRY, ALT/USDC, ALT/USDT, ALT/USDT:USDT, SALT/BTC, SALT/ETH","ALT2612/USD, ALT2612/USDT"
COMP,"COMP/BTC, COMP/USD","COMP/BNB, COMP/BTC, COMP/BUSD, COMP/TRY, COMP/TUSD, COMP/USDT, COMP/USDT:USDT","COMP/USD, COMP/USDT, COMPF0/USTF0"
CORE,,,
TFUEL,,"TFUEL/BNB, TFUEL/BTC, TFUEL/BUSD, TFUEL/PAX, TFUEL/TUSD, TFUEL/USDC, TFUEL/USDT",
PIXEL,,"PIXEL/BNB, PIXEL/BTC, PIXEL/FDUSD, PIXEL/TRY, PIXEL/USDC, PIXEL/USDT, PIXEL/USDT:USDT",
CSPR,,,
DEXE,,"DEXE/BUSD, DEXE/ETH, DEXE/USDT",
SKL,"SKL/BTC, SKL/EUR, SKL/GBP, SKL/USD","SKL/BTC, SKL/BUSD, SKL/TRY, SKL/USDT, SKL/USDT:USDT",
GLMR,,"GLMR/BNB, GLMR/BTC, GLMR/BUSD, GLMR/USDT, GLMR/USDT:USDT",
ANKR,"ANKR/BTC, ANKR/EUR, ANKR/GBP, ANKR/USD","ANKR/BNB, ANKR/BTC, ANKR/BUSD, ANKR/PAX, ANKR/TRY, ANKR/TUSD, ANKR/USDC, ANKR/USDT, ANKR/USDT:USDT",
QTUM,,"QTUM/BNB, QTUM/BTC, QTUM/BUSD, QTUM/ETH, QTUM/USDT, QTUM/USDT:USDT",QTUM/USD
GMX,,"GMX/BTC, GMX/BUSD, GMX/USDT, GMX/USDT:USDT",
FTN,,,
XAUT,,,"BTC/XAUT, ETH/XAUT, TESTXAUT/TESTUSD, TESTXAUTF0/TESTUSDTF0, XAUT/BTC, XAUT/USD, XAUT/USDT, XAUTF0/BTCF0, XAUTF0/USTF0"
BAT,"BAT/BTC, BAT/ETH, BAT/EUR, BAT/USD, BAT/USDC","BAT/BNB, BAT/BTC, BAT/BUSD, BAT/ETH, BAT/PAX, BAT/TUSD, BAT/USDC, BAT/USDT, BAT/USDT:USDT",BAT/USD
ZETA,ZETA/USD,ZETA/USDT:USDT,"ZETA/USD, ZETA/USDT"
KSM,"KSM/USD, KSM/USDT","KSM/AUD, KSM/BNB, KSM/BTC, KSM/BUSD, KSM/ETH, KSM/USDT, KSM/USDT:USDT","KSM/USD, KSM/USDT"
XEM,,"XEM/BNB, XEM/BTC, XEM/BUSD, XEM/ETH, XEM/USDT, XEM/USDT:USDT",
